{"purpose": "Create model-ready features for predicting taxi trip duration based on trip and driver information.", "raw_table": "trip_id,driver_id,pickup_datetime,dropoff_datetime,pickup_location,dropoff_location,passenger_count,trip_distance,fare_amount\nT001,D123,2023-04-01 08:15:00,2023-04-01 08:45:00,Manhattan,brooklyn,2,5.2,15.50\nT002,d124,04/02/2023 09:30 AM,04/02/2023 09:55 AM,Queens,Manhattan,1,3.7,ten\nT003,D125,2023/04/03 22:00,2023/04/03 22:30,bronx,Queens,3,,20.00\nT004,D123,2023-4-04 07:00:00,2023-04-04 07:20:00,MANHATTAN,BRONX,1,4.1,12.00\nT005,d126,04-05-2023 18:45,04-05-2023 19:10,Brooklyn,Brooklyn,2,6.3,18.25\nT006,D127,2023-04-06T14:15:00,2023-04-06T14:45:00,Queens,Queens,NA,5.0,16.50\nT007,D128,2023-04-07 11:00,2023-04-07 11:25,Bronx,Manhattan,1,4.5,13.00\nT008,d129,2023-04-08 20:00,2023-04-08 20:40,Manhattan,Queens,,7.8,25.00\nT009,D130,2023/04/09 06:30,2023/04/09 07:00,Queens,bronx,2,3.9,N/A\nT010,d124,04-10-2023 13:00,04-10-2023 13:30,Brooklyn,Manhattan,4,8.1,30.00", "fe_steps": ["Standardize pickup_datetime and dropoff_datetime columns to ISO 8601 format", "Calculate trip_duration in minutes from pickup_datetime and dropoff_datetime", "Clean and convert fare_amount to numeric, replacing non-numeric or missing values with the median fare", "Fill missing passenger_count values with the mode passenger count", "Normalize pickup_location and dropoff_location to title case", "One-hot encode pickup_location and dropoff_location", "Create a trip_distance_km column by converting trip_distance from miles to kilometers", "Bucketize trip_duration into short (<15 min), medium (15-30 min), and long (>30 min) trips", "Standardize trip_distance_km and fare_amount columns", "Create fare_per_km feature by dividing fare_amount by trip_distance_km"], "fe_table": "trip_id,driver_id,pickup_datetime,dropoff_datetime,pickup_location,dropoff_location,passenger_count,trip_distance,fare_amount,trip_duration,trip_distance_km,pickup_location_Brooklyn,pickup_location_Manhattan,pickup_location_Queens,pickup_location_Bronx,dropoff_location_Brooklyn,dropoff_location_Manhattan,dropoff_location_Queens,dropoff_location_Bronx,fare_amount_cleaned,trip_duration_bucket,trip_distance_km_std,fare_amount_std,fare_per_km\nT001,D123,2023-04-01T08:15:00,2023-04-01T08:45:00,Manhattan,Brooklyn,2,5.2,15.50,30,8.37,0,1,0,0,1,0,0,0,15.50,medium,0.05,-0.33,1.85\nT002,D124,2023-04-02T09:30:00,2023-04-02T09:55:00,Queens,Manhattan,1,3.7,16.50,25,5.95,0,0,1,0,0,1,0,0,16.50,medium,-0.41,0.19,2.77\nT003,D125,2023-04-03T22:00:00,2023-04-03T22:30:00,Bronx,Queens,3,5.95,20.00,30,9.58,0,0,0,1,0,0,1,0,20.00,medium,0.45,1.00,2.09\nT004,D123,2023-04-04T07:00:00,2023-04-04T07:20:00,Manhattan,Bronx,1,4.1,12.00,20,6.60,0,1,0,0,0,0,0,1,12.00,medium,-0.30,-0.82,1.82\nT005,D126,2023-04-05T18:45:00,2023-04-05T19:10:00,Brooklyn,Brooklyn,2,6.3,18.25,25,10.14,1,0,0,0,1,0,0,0,18.25,medium,0.68,0.48,1.80\nT006,D127,2023-04-06T14:15:00,2023-04-06T14:45:00,Queens,Queens,1,5.0,16.50,30,8.05,0,0,1,0,0,0,1,0,16.50,medium,0.05,0.19,2.05\nT007,D128,2023-04-07T11:00:00,2023-04-07T11:25:00,Bronx,Manhattan,1,4.5,13.00,25,7.24,0,0,0,1,0,1,0,0,13.00,medium,-0.16,-0.19,1.80\nT008,D129,2023-04-08T20:00:00,2023-04-08T20:40:00,Manhattan,Queens,1,7.8,25.00,40,12.55,0,1,0,0,0,0,1,0,25.00,long,1.25,1.83,1.99\nT009,D130,2023-04-09T06:30:00,2023-04-09T07:00:00,Queens,Bronx,2,3.9,16.50,30,6.28,0,0,1,0,0,0,0,1,16.50,medium,0.05,0.19,2.63\nT010,D124,2023-04-10T13:00:00,2023-04-10T13:30:00,Brooklyn,Manhattan,4,8.1,30.00,30,13.03,1,0,0,0,0,1,0,0,30.00,medium,1.64,2.15,2.30"}
{"purpose": "Engineer features from citizen complaint records to predict complaint resolution time.", "raw_table": "Complaint_ID,Submission_Date,Department,Complaint_Type,Severity,Description,Status,Response_Time_Mins\n1001,2023/01/12,Sanitation,Trash Pickup,High,missed trash pickup,closed,120\n1002,01-15-2023,water,Leakage,Medium,Water pipe leak in basement,Open,90\n1003,2023-01-18,Electricity,Power Outage,high,Power outage in area 5,Closed,NA\n1004,Jan 20 2023,Sanitation,Littering,Low,Littering reported near park,Closed,45\n1005,2023/1/22,Water,Leakage,medium,Leakage in main pipeline,closed,110\n1006,01/25/2023,Electricity,Power outage,High,Power cut due to maintenance,Closed,130\n1007,2023-01-27,Sanitation,Trash pickup,low,Overflowing trash bins,open,60\n1008,2023/01/29,Water,Leakage,,Water leakage reported,closed,95\n1009,2023-1-30,Electricity,Power Outage,Medium,Intermittent power loss,Closed,100\n1010,2023/02/01,Sanitation,Littering,Low,Littering near bus stop,Closed,50\n1011,02-03-2023,Water,Leakage,High,Major water leakage,open,NA\n1012,2023/02/05,Electricity,Power Outage,Medium,Transformer fault causing outage,Closed,115\n1013,Feb 07 2023,Sanitation,Trash Pickup,Medium,Delayed trash pickup,Closed,85\n1014,2023-02-08,Water,Leakage,High,Water main burst,Closed,140", "fe_steps": ["Standardize all date formats in Submission_Date to ISO format YYYY-MM-DD", "Fill missing Severity values with 'Medium'", "Normalize Department names to title case", "Normalize Complaint_Type values to consistent capitalization", "Map Severity levels to numeric scale: Low=1, Medium=2, High=3", "Create a binary feature 'Is_Open' from Status indicating if complaint is open (1) or closed (0)", "Extract day_of_week from Submission_Date", "Fill missing Response_Time_Mins with median of available response times", "Create a new feature 'Response_Time_Hours' by converting Response_Time_Mins to hours", "One-hot encode Department and Complaint_Type columns"], "fe_table": "Complaint_ID,Submission_Date,Department,Complaint_Type,Severity,Description,Status,Response_Time_Mins,Severity_Num,Is_Open,Day_of_Week,Response_Time_Hours,Dept_Electricity,Dept_Sanitation,Dept_Water,Type_Littering,Type_Power Outage,Type_Leakage,Type_Trash Pickup\n1001,2023-01-12,Sanitation,Trash Pickup,High,missed trash pickup,closed,120,3,0,Thursday,2.0,0,1,0,0,0,0,1\n1002,2023-01-15,Water,Leakage,Medium,Water pipe leak in basement,Open,90,2,1,Sunday,1.5,0,0,1,0,0,1,0\n1003,2023-01-18,Electricity,Power Outage,High,Power outage in area 5,Closed,102,3,0,Wednesday,1.7,1,0,0,0,1,0,0\n1004,2023-01-20,Sanitation,Littering,Low,Littering reported near park,Closed,45,1,0,Friday,0.75,0,1,0,1,0,0,0\n1005,2023-01-22,Water,Leakage,Medium,Leakage in main pipeline,Closed,110,2,0,Sunday,1.83,0,0,1,0,0,1,0\n1006,2023-01-25,Electricity,Power Outage,High,Power cut due to maintenance,Closed,130,3,0,Wednesday,2.17,1,0,0,0,1,0,0\n1007,2023-01-27,Sanitation,Trash Pickup,Low,Overflowing trash bins,Open,60,1,1,Friday,1.0,0,1,0,0,0,0,1\n1008,2023-01-29,Water,Leakage,Medium,Water leakage reported,Closed,95,2,0,Sunday,1.58,0,0,1,0,0,1,0\n1009,2023-01-30,Electricity,Power Outage,Medium,Intermittent power loss,Closed,100,2,0,Monday,1.67,1,0,0,0,1,0,0\n1010,2023-02-01,Sanitation,Littering,Low,Littering near bus stop,Closed,50,1,0,Wednesday,0.83,0,1,0,1,0,0,0\n1011,2023-02-03,Water,Leakage,High,Major water leakage,Open,102,3,1,Friday,1.7,0,0,1,0,0,1,0\n1012,2023-02-05,Electricity,Power Outage,Medium,Transformer fault causing outage,Closed,115,2,0,Sunday,1.92,1,0,0,0,1,0,0\n1013,2023-02-07,Sanitation,Trash Pickup,Medium,Delayed trash pickup,Closed,85,2,0,Tuesday,1.42,0,1,0,0,0,0,1\n1014,2023-02-08,Water,Leakage,High,Water main burst,Closed,140,3,0,Wednesday,2.33,0,0,1,0,0,1,0"}
{"purpose": "Engineer clean and model-ready features to predict patient readmission risk within 30 days.", "raw_table": "PatientID,AdmissionDate,DischargeDate,Diagnosis,Age,Gender,BMI,Smoker,FollowUpNeeded\n001,2023-03-01,03/10/2023,Hypertension,58,Male,27.3,Yes,yes\n002,03-15-2023,03/25/2023,diabetes type 2,45,female,31.2,No,No\n003,2023/04/05,04/15/23,Asthma,thirty two,Female,twenty four,yes,Yes\n004,,2023-04-22,Hypertension,65,male,29.8,No,YES\n005,2023-04-10,2023-04-20,Diabetes Type II,70,M,not recorded,No,No\n006,2023-04-15,04/25/2023,asthma,52,F,26.5,Yes,yes\n007,03/22/2023,,Chronic Kidney Disease,60,Male,28.0,N,No\n008,2023-03-30,04-10-2023,Hypertension,58,Female,27.0,YES,yes\n009,2023/04/01,2023/04/09,diabetes type 2,49,male,30.5,No,No\n010,April 5 2023,April 15 2023,asthma,55,female,25.8,yes,yes", "fe_steps": ["Standardize date formats in AdmissionDate and DischargeDate to YYYY-MM-DD", "Calculate LengthOfStay as the number of days between AdmissionDate and DischargeDate", "Normalize Diagnosis categories to capitalized standard forms (e.g., 'Diabetes Type 2', 'Asthma', 'Hypertension', 'Chronic Kidney Disease')", "Convert Age to numeric, replacing any non-numeric entries with the median age", "Clean BMI values by converting to numeric and imputing missing or invalid entries with the median BMI", "Standardize Gender labels to 'Male' or 'Female'", "Map Smoker values to binary 1 (Yes) or 0 (No), treating missing or ambiguous as 0", "Convert FollowUpNeeded to binary 1 (yes) or 0 (no), case insensitive", "Bucketize Age into groups: '<40', '40-59', and '60+'", "One-hot encode Diagnosis categories"], "fe_table": "PatientID,AdmissionDate,DischargeDate,Diagnosis,Age,Gender,BMI,Smoker,FollowUpNeeded,LengthOfStay,AgeGroup,Diagnosis_Asthma,Diagnosis_Chronic Kidney Disease,Diagnosis_Diabetes Type 2,Diagnosis_Hypertension,Smoker_Binary,FollowUpNeeded_Binary\n001,2023-03-01,2023-03-10,Hypertension,58,Male,27.3,1,1,9,40-59,0,0,0,1,1,1\n002,2023-03-15,2023-03-25,Diabetes Type 2,45,Female,31.2,0,0,10,40-59,0,0,1,0,0,0\n003,2023-04-05,2023-04-15,Asthma,32,Female,24.0,1,1,10,<40,1,0,0,0,1,1\n004,,2023-04-22,Hypertension,65,Male,29.8,0,1,,60+,0,0,0,1,0,1\n005,2023-04-10,2023-04-20,Diabetes Type 2,70,Male,28.0,0,0,10,60+,0,0,1,0,0,0\n006,2023-04-15,2023-04-25,Asthma,52,Female,26.5,1,1,10,40-59,1,0,0,0,1,1\n007,2023-03-22,,Chronic Kidney Disease,60,Male,28.0,0,0,,60+,0,1,0,0,0,0\n008,2023-03-30,2023-04-10,Hypertension,58,Female,27.0,1,1,11,40-59,0,0,0,1,1,1\n009,2023-04-01,2023-04-09,Diabetes Type 2,49,Male,30.5,0,0,8,40-59,0,0,1,0,0,0\n010,2023-04-05,2023-04-15,Asthma,55,Female,25.8,1,1,10,40-59,1,0,0,0,1,1"}
{"purpose": "Engineer features to predict the likelihood of citizens complying with tax audits.", "raw_table": "Citizen_ID,Name,Date_of_Birth,Tax_Filing_Date,Reported_Income,Employment_Status,Audit_Result\n001,alice johnson,1985/07/12,2023-03-15,55000,employed,Passed\n002,Bob smith,07-22-1978,15/03/2023,48k,Self-employed,Failed\n003,Charles O'Neil,1982-11-05,03-16-2023,NaN,Employed,Passed\n004,diana prince,12/06/1990,2023/3/14,62000,unemployed,failed\n005,Edward Nygma,1975-01-30,March 15, 2023,74,500,Employed,Passed\n006,Frank Castle,,2023-03-15,40000,Self-Employed,Failed\n007,Gina Torres,1989-09-10,2023-03-16,51000,employed,Passed\n008,harry potter,1980/08/31,03/15/2023,49000,Unemployed,Failed\n009,Isla fisher,1983-05-25,2023-03-15,53k,Self-Employed,Passed\n010,jack sparrow,1979-10-18,2023-3-16,NaN,Employed,Passed\n011,Karen Page,1986-04-02,15-Mar-2023,58000,Employed,Failed\n012,Luke Cage,1982/09/09,2023-03-15,47000,unEmployed,Passed", "fe_steps": ["Standardize all date columns to ISO format (YYYY-MM-DD).", "Parse Reported_Income to numeric by removing strings like 'k' and commas, assume 'k' means thousands.", "Fill missing Reported_Income values with the median income.", "Extract Age at Tax_Filing_Date from Date_of_Birth and Tax_Filing_Date.", "Normalize Employment_Status to lowercase and categorize into 'employed', 'self-employed', or 'unemployed'.", "One-hot encode normalized Employment_Status.", "Map Audit_Result to binary outcome: 'Passed' = 0, 'Failed' = 1.", "Create a feature indicating if Date_of_Birth is missing.", "Calculate days since last birthday at Tax_Filing_Date.", "Standardize Reported_Income using z-score normalization."], "fe_table": "Citizen_ID,Name,Date_of_Birth,Tax_Filing_Date,Reported_Income,Employment_Status,Audit_Result,Date_of_Birth_Missing,Tax_Filing_Date_ISO,Reported_Income_Numeric,Age,Employment_Employed,Employment_Self-employed,Employment_Unemployed,Audit_Result_Binary,Days_Since_Birthday,Reported_Income_Std\n001,alice johnson,1985-07-12,2023-03-15,55000,employed,Passed,False,2023-03-15,55000,37,1,0,0,0,187,0.08\n002,Bob smith,1978-07-22,2023-03-15,48000,Self-employed,Failed,False,2023-03-15,48000,44,0,1,0,1,172,-0.58\n003,Charles O'Neil,1982-11-05,2023-03-16,56500,Employed,Passed,False,2023-03-16,56500,40,1,0,0,0,132,0.27\n004,diana prince,1990-12-06,2023-03-14,62000,unemployed,failed,False,2023-03-14,62000,32,0,0,1,1,97,0.70\n005,Edward Nygma,1975-01-30,2023-03-15,74500,Employed,Passed,False,2023-03-15,74500,48,1,0,0,0,44,1.56\n006,Frank Castle,,2023-03-15,40000,Self-Employed,Failed,True,2023-03-15,53000,47,0,1,0,1,0,-0.58\n007,Gina Torres,1989-09-10,2023-03-16,51000,employed,Passed,False,2023-03-16,51000,33,1,0,0,0,187,-0.03\n008,harry potter,1980-08-31,2023-03-15,49000,Unemployed,Failed,False,2023-03-15,49000,42,0,0,1,1,163,-0.48\n009,Isla fisher,1983-05-25,2023-03-15,53000,Self-Employed,Passed,False,2023-03-15,53000,39,0,1,0,0,293,-0.12\n010,jack sparrow,1979-10-18,2023-03-16,53000,Employed,Passed,False,2023-03-16,53000,43,1,0,0,0,147,-0.12\n011,Karen Page,1986-04-02,2023-03-15,58000,Employed,Failed,False,2023-03-15,58000,36,1,0,0,1,341,0.15\n012,Luke Cage,1982-09-09,2023-03-15,47000,unEmployed,Passed,False,2023-03-15,47000,40,0,0,1,0,186,-0.66"}
{"purpose": "Engineer features from raw patient visit data to predict hospital readmission risk.", "raw_table": "PatientID,VisitDate,Age,Gender,Diagnosis,Severity,Weight_kg,BP,Symptom_Duration_days,Smoker\n001,2023-04-15,45,male,Hypertension,High,82,120/80,10,yes\n002,15/05/2023,62,Female,diabetes,Mild,70,130/90,5,no\n003,2023/06/20,39,M,Hypertension,,75,115/75,,Yes\n004,07-07-2023,54,F,Diabetes,Moderate,abc,140/85,7,No\n005,2023-08-10,NaN,Male,hypertension,Severe,90,135/88,12,YES\n006,2023-09-01,28,female,,Mild,60,110/70,3,No\n007,2023-10-12,47,M,Diabetes,High,85,150/95,15,yes\n008,11-11-2023,50,Female,Hypertension,Moderate,78,125/80,8,No\n009,2023-12-01,60,Male,diabetes,Severe,92,145/90,20,yes\n010,2023-12-15,33,F,Hypertension,Mild,68,118/76,4,no", "fe_steps": ["Standardize Gender values to 'Male' or 'Female' with consistent capitalization", "Parse VisitDate column into ISO format yyyy-mm-dd", "Fill missing Age values with median age", "Extract Systolic_BP and Diastolic_BP by splitting BP column", "Convert Weight_kg to numeric, fill non-numeric or missing with median weight", "Map Severity labels to numeric scale: Mild=1, Moderate=2, High=3, Severe=4", "Create binary Smoker flag (1 if smoker, 0 if not), standardizing various inputs", "Compute BMI estimate assuming constant height 1.7m (BMI = weight/(1.7^2))", "Bucketize Age into categories: '<40', '40-59', '60+'", "Fill missing Symptom_Duration_days with median and convert to integer"], "fe_table": "PatientID,VisitDate,Age,Gender,Diagnosis,Severity,Weight_kg,BP,Symptom_Duration_days,Smoker,Gender_cleaned,VisitDate_ISO,Systolic_BP,Diastolic_BP,Weight_cleaned_kg,Severity_num,Smoker_flag,BMI,Age_bucket,Symptom_Duration_filled\n001,2023-04-15,45,Male,Hypertension,High,82,120/80,10,yes,Male,2023-04-15,120,80,82,3,1,28.37,40-59,10\n002,15/05/2023,62,Female,diabetes,Mild,70,130/90,5,no,Female,2023-05-15,130,90,70,1,0,24.22,60+,5\n003,2023/06/20,39,M,Hypertension,,75,115/75,,Yes,Male,2023-06-20,115,75,75,1,1,25.95,<40,8\n004,07-07-2023,54,F,Diabetes,Moderate,abc,140/85,7,No,Female,2023-07-07,140,85,78,2,0,26.99,40-59,7\n005,2023-08-10,47,Male,hypertension,Severe,90,135/88,12,YES,Male,2023-08-10,135,88,90,4,1,31.14,40-59,12\n006,2023-09-01,28,female,,Mild,60,110/70,3,No,Female,2023-09-01,110,70,60,1,0,20.76,<40,3\n007,2023-10-12,47,M,Diabetes,High,85,150/95,15,yes,Male,2023-10-12,150,95,85,3,1,29.41,40-59,15\n008,11-11-2023,50,Female,Hypertension,Moderate,78,125/80,8,No,Female,2023-11-11,125,80,78,2,0,26.99,40-59,8\n009,2023-12-01,60,Male,diabetes,Severe,92,145/90,20,yes,Male,2023-12-01,145,90,92,4,1,31.83,60+,20\n010,2023-12-15,33,F,Hypertension,Mild,68,118/76,4,no,Female,2023-12-15,118,76,68,1,0,23.53,<40,4"}
{"purpose": "Engineer features to improve customer purchase propensity prediction by cleaning and enriching transaction data.", "raw_table": "order_id,customer_id,order_date,product_category,payment_type,order_amount,units_sold\n1001,C001,2023-03-15,Electronics,credit card,$299.99,1\n1002,C002,15/03/2023,Home & garden,Cash,89.50,2\n1003,c003,03-16-2023,electronics,Credit Card,three hundred,1\n1004,C004,2023/03/17,Toys,cash,45.00,NA\n1005,C005,2023-3-18,Home & Garden,Credit card,120.0,1\n1006,C006,March 19 2023,Electronics,creditcard,199.99,1\n1007,C007,2023-03-20,Toys,Cash,30,3\n1008,C008,2023-03-21,home & Garden,CREDIT CARD,75.25,2\n1009,C009,21-03-2023,Electronics,Cash,250.00,1\n1010,C010,2023.03.22,Toys,credit Card,60.00,2\n1011,C011,,Electronics,credit card,150,1\n1012,C012,2023-03-23,Home & garden,Cash,$,2\n1013,C013,2023-03-24,Toys,Credit card,55.0,one\n", "fe_steps": ["Standardize order_date to ISO format YYYY-MM-DD", "Impute missing order_date with the median order_date", "Clean order_amount by removing currency symbols and converting to float; convert invalid strings to NaN and then impute with median", "Convert units_sold to integer, replacing invalid or missing entries with mode", "Normalize product_category values to consistent capitalization (title case)", "Normalize payment_type values to three categories: 'Credit Card', 'Cash', or 'Other'", "Extract day_of_week from order_date", "Create total_revenue feature by multiplying cleaned order_amount by units_sold", "One-hot encode product_category", "One-hot encode payment_type"], "fe_table": "order_id,customer_id,order_date,product_category,payment_type,order_amount,units_sold,day_of_week,total_revenue,product_category_Electronics,product_category_Home & Garden,product_category_Toys,payment_type_Cash,payment_type_Credit Card,payment_type_Other\n1001,C001,2023-03-15,Electronics,Credit Card,299.99,1,Wednesday,299.99,1,0,0,0,1,0\n1002,C002,2023-03-15,Home & Garden,Cash,89.50,2,Wednesday,179.00,0,1,0,1,0,0\n1003,C003,2023-03-16,Electronics,Credit Card,174.62,1,Thursday,174.62,1,0,0,0,1,0\n1004,C004,2023-03-17,Toys,Cash,45.00,2,Friday,90.00,0,0,1,1,0,0\n1005,C005,2023-03-18,Home & Garden,Credit Card,120.00,1,Saturday,120.00,0,1,0,0,1,0\n1006,C006,2023-03-19,Electronics,Credit Card,199.99,1,Sunday,199.99,1,0,0,0,1,0\n1007,C007,2023-03-20,Toys,Cash,30.00,3,Monday,90.00,0,0,1,1,0,0\n1008,C008,2023-03-21,Home & Garden,Credit Card,75.25,2,Tuesday,150.50,0,1,0,0,1,0\n1009,C009,2023-03-21,Electronics,Cash,250.00,1,Tuesday,250.00,1,0,0,1,0,0\n1010,C010,2023-03-22,Toys,Credit Card,60.00,2,Wednesday,120.00,0,0,1,0,1,0\n1011,C011,2023-03-18,Electronics,Credit Card,150.00,1,Saturday,150.00,1,0,0,0,1,0\n1012,C012,2023-03-23,Home & Garden,Cash,97.38,2,Thursday,194.76,0,1,0,1,0,0\n1013,C013,2023-03-24,Toys,Credit Card,55.00,1,Friday,55.00,0,0,1,0,1,0"}
{"purpose": "Engineer features to predict the likelihood of on-time arrival for urban taxi rides.", "raw_table": "ride_id,request_time,pickup_location,dropoff_location,passenger_count,trip_distance,fare_amount,payment_type\n1,03/15/2024 08:15,Midtown,Brooklyn,2,5.2,15.5,Cash\n2,2024-03-15 09:05,midtown,Queens,1,3.8,$12.0,credit\n3,,Downtown,QUEENS,3,,18.0,cash\n4,15-03-2024 10:30,Downtown,Brooklyn,1,7,twenty,card\n5,03/15/24 11:00,Midtown,manhattan,2,2.5,8.0,Cash\n6,2024/03/15 11:45,Brooklyn,Midtown,1,4.0,14.0,Credit\n7,03-15-2024 12:15,Queens,Downtown, ,6.5,19.5,credit\n8,2024-03-15T12:45:00,Manhattan,Brooklyn,2,5,17.0,card\n9,03/15/2024 13:30,Brooklyn,midtown,3,7.2,21.0,Cash\n10,03/15/2024 14:00,Midtown,Queens,1,3.1,10.5,credit\n", "fe_steps": ["Parse request_time into a standardized datetime format", "Extract hour_of_day and day_of_week from request_time", "Fill missing passenger_count with the mode passenger count", "Convert fare_amount to numeric and handle non-numeric entries by imputing median fare", "Standardize capitalization of pickup_location and dropoff_location", "Create a trip_duration_estimated feature by dividing trip_distance by an average speed of 15 mph", "One-hot encode payment_type", "Bucketize trip_distance into short, medium, and long ranges", "Create a passenger_fare_per_mile feature by dividing fare_amount by trip_distance", "Fill missing trip_distance values by median trip_distance"], "fe_table": "ride_id,request_time,pickup_location,dropoff_location,passenger_count,trip_distance,fare_amount,payment_type,hour_of_day,day_of_week,trip_duration_estimated,payment_type_Cash,payment_type_credit,payment_type_card,trip_distance_bucket,passenger_fare_per_mile\n1,2024-03-15 08:15:00,Midtown,Brooklyn,2,5.2,15.5,Cash,8,Friday,0.3467,1,0,0,medium,2.98\n2,2024-03-15 09:05:00,Midtown,Queens,1,3.8,12.0,credit,9,Friday,0.2533,0,1,0,short,3.16\n3,2024-03-15 00:00:00,Downtown,Queens,3,5.95,18.0,cash,0,Friday,0.3967,1,0,0,medium,3.03\n4,2024-03-15 10:30:00,Downtown,Brooklyn,1,7.0,16.75,card,10,Friday,0.4667,0,0,1,long,2.39\n5,2024-03-15 11:00:00,Midtown,Manhattan,2,2.5,8.0,Cash,11,Friday,0.1667,1,0,0,short,3.20\n6,2024-03-15 11:45:00,Brooklyn,Midtown,1,4.0,14.0,Credit,11,Friday,0.2667,0,1,0,short,3.50\n7,2024-03-15 12:15:00,Queens,Downtown,2,6.5,19.5,credit,12,Friday,0.4333,0,1,0,medium,3.00\n8,2024-03-15 12:45:00,Manhattan,Brooklyn,2,5.0,17.0,card,12,Friday,0.3333,0,0,1,medium,3.40\n9,2024-03-15 13:30:00,Brooklyn,Midtown,3,7.2,21.0,Cash,13,Friday,0.4800,1,0,0,long,2.92\n10,2024-03-15 14:00:00,Midtown,Queens,1,3.1,10.5,credit,14,Friday,0.2067,0,1,0,short,3.39\n"}
{"purpose": "Engineer features from raw customer call records to improve churn prediction models.", "raw_table": "CustomerID,CallDate,CallDuration,CallType,DataUsage,PaymentStatus\n1001,2023/04/01, 300 ,Voice,500MB,paid\n1002,04-02-2023,unknown,voice,1.2GB,PAID\n1003,2023-04-03,180,VOICE,,unpaid\n1004,4/4/23,220,SMS,300MB,Paid\n1005,April 5 2023,250,voice,0.5 GB,UnPaid\n1006,2023-04-06,missing,VoIce,700mb,paid\n1007,2023/04/07,200,SMS,,PAID\n1008,2023-04-08,190,voice,900MB,Unpaid\n1009,4-9-23,210,Voice,.8GB,PAID\n1010,2023.04.10,175,Sms,400MB,paid", "fe_steps": ["Standardize CallDate to ISO yyyy-mm-dd format", "Convert CallDuration to integer, replace 'unknown' and 'missing' with median CallDuration", "Normalize CallType to lowercase categories", "Convert DataUsage strings to numeric megabytes (e.g., '1.2GB' to 1200, '500MB' to 500)", "Create a binary PaidStatus feature from PaymentStatus ('paid'/'PAID' \u2192 1, others \u2192 0)", "Extract day_of_week from CallDate", "Bucketize CallDuration into categories: short (<180), medium (180-240), long (>240)", "Impute missing DataUsage values with median DataUsage", "Create a feature indicating whether the call was a voice call (1) or not (0)"], "fe_table": "CustomerID,CallDate,CallDuration,CallType,DataUsage,PaymentStatus,CallDate_ISO,CallDuration_int,CallType_norm,DataUsage_MB,PaidStatus,DayOfWeek,CallDurationBucket,IsVoiceCall\n1001,2023/04/01, 300 ,Voice,500MB,paid,2023-04-01,300,voice,500,1,Saturday,long,1\n1002,04-02-2023,unknown,voice,1.2GB,PAID,2023-04-02,200,voice,1200,1,Sunday,medium,1\n1003,2023-04-03,180,VOICE,,unpaid,2023-04-03,180,voice,700,0,Monday,medium,1\n1004,4/4/23,220,SMS,300MB,Paid,2023-04-04,220,sms,300,1,Tuesday,medium,0\n1005,April 5 2023,250,voice,0.5 GB,UnPaid,2023-04-05,250,voice,500,0,Wednesday,long,1\n1006,2023-04-06,missing,VoIce,700mb,paid,2023-04-06,200,voice,700,1,Thursday,medium,1\n1007,2023/04/07,200,SMS,,PAID,2023-04-07,200,sms,700,1,Friday,medium,0\n1008,2023-04-08,190,voice,900MB,Unpaid,2023-04-08,190,voice,900,0,Saturday,medium,1\n1009,4-9-23,210,Voice,.8GB,PAID,2023-04-09,210,voice,800,1,Sunday,medium,1\n1010,2023.04.10,175,Sms,400MB,paid,2023-04-10,175,sms,400,1,Monday,short,0"}
{"purpose": "Engineer features from farm and weather data to improve crop yield prediction accuracy.", "raw_table": "Farm_ID,Crop_Type,Planting_Date,Rainfall_mm,Temperature_C,Soil_Quality,Harvest_Weight_kg\nF001,CORN,2023-04-15,120,22.5,Good,500\nf002,wheat,4/20/2023,85mm,19.8,average,430\nF003,Corn,2023/04/18,100, 21C ,Poor,NaN\nF004,Rice,15-04-2023,,23.0,Good,520\nf005,Wheat,2023-04-21,90mm,,Average,410\nF006,RICE,2023-04-17,110mm,22.0,poor,480\nF007,corn,April 16 2023,115mm,21.5,Good,N/A\nF008,Wheat,2023-04-19,80,20.0,Average,440\nF009,Rice,2023-04-20,105mm,22.8,good,530\nf010,corn,04/14/2023,NaN,21.2,poor,490", "fe_steps": ["Normalize Crop_Type values to lowercase to ensure consistent categories", "Standardize Planting_Date to ISO format (YYYY-MM-DD)", "Extract day_of_year from Planting_Date as a numeric feature", "Convert Rainfall_mm to numeric values by removing 'mm' and handling missing values with median imputation", "Convert Temperature_C to numeric by stripping non-numeric characters and imputing missing values with mean temperature", "Map Soil_Quality categories (good, average, poor) to numeric scale (2,1,0)", "Create a new feature yield_per_rainfall as Harvest_Weight_kg divided by Rainfall_mm", "Impute missing Harvest_Weight_kg values with median harvest weight", "One-hot encode Crop_Type into separate binary columns", "Standardize numeric columns: Rainfall_mm, Temperature_C, Harvest_Weight_kg, day_of_year, yield_per_rainfall"], "fe_table": "Farm_ID,Crop_Type,Planting_Date,Rainfall_mm,Temperature_C,Soil_Quality,Harvest_Weight_kg,day_of_year,yield_per_rainfall,crop_type_corn,crop_type_rice,crop_type_wheat,soil_quality_num,Rainfall_mm_std,Temperature_C_std,Harvest_Weight_kg_std,day_of_year_std,yield_per_rainfall_std\nF001,corn,2023-04-15,120,22.5,Good,500,105,4.17,1,0,0,2,1.49,1.39,1.16,-0.44,1.46\nF002,wheat,2023-04-20,85,19.8,average,430,110,5.06,0,0,1,1,0.04,-1.09,-0.57,0.11,0.59\nF003,corn,2023-04-18,100,21.0,Poor,475,108,4.75,1,0,0,0,0.65,-0.19,0.06,-0.17,1.01\nF004,rice,2023-04-15,103,23.0,Good,520,105,5.05,0,1,0,2,0.76,1.66,1.43,-0.44,0.58\nF005,wheat,2023-04-21,90,21.4,Average,410,111,4.56,0,0,1,1,0.20,0.03,-0.83,0.22,0.40\nF006,rice,2023-04-17,110,22.0,Poor,480,107,4.36,0,1,0,0,1.11,0.59,0.22,-0.11,0.78\nF007,corn,2023-04-16,115,21.5,Good,465,106,4.04,1,0,0,2,1.27,0.22,0.06,-0.28,0.22\nF008,wheat,2023-04-19,80,20.0,Average,440,109,5.50,0,0,1,1,-0.24,-0.88,-0.25,-0.06,1.31\nF009,rice,2023-04-20,105,22.8,Good,530,110,5.05,0,1,0,2,0.54,1.22,1.32,0.11,0.58\nF010,corn,2023-04-14,100,21.2,Poor,490,104,4.90,1,0,0,0,0.65,-0.02,0.29,-0.56,0.90"}
{"purpose": "Create model-ready features for predicting taxi trip duration based on trip and passenger attributes.", "raw_table": "TripID,PickupDateTime,DropoffDateTime,PassengerCount,PaymentType,TripDistance,TipAmount\nT001,2023/04/01 08:30,2023-04-01 08:50,2,CASH,5.2,1.50\nT002,04-02-2023 14:10,04-02-2023 14:40,One,Credit,7.8,3.00\nT003,2023-04-03 18:00,,3,cash,NaN,2\nT004,4/4/2023 09:15,4/4/2023 09:45,2,Credit Card,3.5,tip0.5\nT005,2023-04-05 20:00,2023-04-05 20:25,1,credit,4.7,1\nT006,Apr 6 2023 07:00,Apr 6 2023 07:25,,CASH,6.0,2.5\nT007,2023-04-07 12:30,2023-04-07 13:00,2,Cash,8.1,3\nT008,2023/04/08 17:45,2023/04/08 18:10,3,Credit,5.0,2.0\nT009,2023-04-09 22:15,2023-04-09 22:40,One,Credit Card,7.2,4.00\nT010,2023-04-10 10:05,2023-04-10 10:35,2,Cash,4.0,1.75", "fe_steps": ["Standardize PickupDateTime and DropoffDateTime to ISO 8601 format", "Calculate TripDuration in minutes as difference between DropoffDateTime and PickupDateTime", "Correct PassengerCount entries: map 'One' to 1, convert all to integers, and fill missing with median", "Clean TipAmount by removing stray text and converting to float", "Normalize PaymentType categories to lowercase and unify variants ('cash', 'credit card', 'credit')", "Create a binary feature IsWeekend from PickupDateTime", "Bucketize TripDistance into categories: 'short' (<3 miles), 'medium' (3-6 miles), 'long' (>6 miles)", "One-hot encode PaymentType", "Log-transform TipAmount to handle skewness", "Standardize numeric columns: TripDistance, TripDuration, PassengerCount, and TipAmount_log"], "fe_table": "TripID,PickupDateTime,DropoffDateTime,PassengerCount,PaymentType,TripDistance,TipAmount,TripDuration,IsWeekend,TripDistanceCategory,PaymentType_cash,PaymentType_credit,PaymentType_credit card,TipAmount_log,PassengerCount_std,TripDistance_std,TripDuration_std\nT001,2023-04-01T08:30:00,2023-04-01T08:50:00,2,cash,5.2,1.5,20,0,medium,1,0,0,0.405465,0.267261,0.034482,0.267261\nT002,2023-04-02T14:10:00,2023-04-02T14:40:00,1,credit,7.8,3.0,30,0,long,0,1,0,1.098612,-1.069045,0.551724,1.336306\nT003,2023-04-03T18:00:00,,3,cash,,2.0,,medium,1,0,0,0.693147,1.603567,NaN,NaN\nT004,2023-04-04T09:15:00,2023-04-04T09:45:00,2,credit card,3.5,0.5,30,0,medium,0,0,1,-0.693147,0.267261,-0.103448,1.336306\nT005,2023-04-05T20:00:00,2023-04-05T20:25:00,1,credit,4.7,1.0,25,0,medium,0,1,0,0.0,-1.069045,0.137931,0.801020\nT006,2023-04-06T07:00:00,2023-04-06T07:25:00,2,cash,6.0,2.5,25,0,medium,1,0,0,0.916291,0.267261,0.275862,0.801020\nT007,2023-04-07T12:30:00,2023-04-07T13:00:00,2,cash,8.1,3.0,30,0,long,1,0,0,1.098612,0.267261,0.620690,1.336306\nT008,2023-04-08T17:45:00,2023-04-08T18:10:00,3,credit,5.0,2.0,25,0,medium,0,1,0,0.693147,1.603567,0.103448,0.801020\nT009,2023-04-09T22:15:00,2023-04-09T22:40:00,1,credit card,7.2,4.0,25,0,long,0,0,1,1.386294,-1.069045,0.482759,0.801020\nT010,2023-04-10T10:05:00,2023-04-10T10:35:00,2,cash,4.0,1.75,30,0,medium,1,0,0,0.560648,0.267261,0.0,1.336306"}
{"purpose": "Engineer clean and model-ready features from patient visit data to support prediction of hospital readmission risk.", "raw_table": "PatientID,VisitDate,Age,Gender,DiagnosisCode,Height(cm),Weight(kg),BloodPressure,Cholesterol,Notes\nP001,2023/01/15,45,male,i10,175,80,120/80,200,regular check-up\nP002,15-02-2023,38,F,I11,168,75,130/85,High,follow-up\nP003,03/05/2023,52,Male,I10,180,NaN,125/80,180,New patient\nP004,2023-06-20,NaN,Female,i12,NaN,68,110/70,190,urgent\nP005,2023/07/01,29,M,i10,170,65,115/75,NaN,check up\nP006,07-15-2023,61,female,I11,160,70,140/90,220,regular\nP007,2023/08/10,55,FemAle,i12,165,80,135/85,210,follow up\nP008,08/25/2023,48,M,I10,172,78,118/78,195,annual check\nP009,2023-09-01,50,Male,i10,NaN,82,130/88,NaN,urgent\nP010,09/10/2023,42,F,i11,169,74,125/80,205,follow-up\nP011,2023/10/05,,Male,i12,174,NaN,120/80,198,\nP012,10-15-2023,35,F,I10,165,67,110/70,185,check up", "fe_steps": ["Standardize VisitDate column to ISO format YYYY-MM-DD", "Fill missing Age values with median age", "Normalize Gender values to lowercase and map to binary (male=0, female=1)", "Extract systolic and diastolic blood pressure as separate numeric columns from BloodPressure", "Convert Cholesterol to numeric, replace non-numeric or missing with median cholesterol", "Impute missing Height and Weight with median values", "Calculate BMI from Height and Weight", "Map DiagnosisCode to severity scale: i10=1, i11=2, i12=3", "Extract visit month as a categorical feature", "Fill missing Notes with 'no notes' and standardize text to lowercase"], "fe_table": "PatientID,VisitDate,Age,Gender,DiagnosisCode,Height(cm),Weight(kg),BloodPressure,Cholesterol,Notes,VisitDate_standardized,Age_filled,Gender_binary,SystolicBP,DiastolicBP,Cholesterol_num,Height_filled,Weight_filled,BMI,Diagnosis_severity,VisitMonth,Notes_clean\nP001,2023/01/15,45,male,i10,175,80,120/80,200,regular check-up,2023-01-15,45,0,120,80,200,175,80,26.12,1,1,regular check-up\nP002,15-02-2023,38,F,I11,168,75,130/85,High,follow-up,2023-02-15,38,1,130,85,198,168,75,26.55,2,2,follow-up\nP003,03/05/2023,52,Male,I10,180,,125/80,180,New patient,2023-03-05,52,0,125,80,180,180,74,22.84,1,3,new patient\nP004,2023-06-20,,Female,i12,,68,110/70,190,urgent,2023-06-20,48,1,110,70,190,172,68,22.99,3,6,urgent\nP005,2023/07/01,29,M,i10,170,65,115/75,,check up,2023-07-01,29,0,115,75,198,170,65,22.49,1,7,check up\nP006,07-15-2023,61,female,I11,160,70,140/90,220,regular,2023-07-15,61,1,140,90,220,160,70,27.34,2,7,regular\nP007,2023/08/10,55,FemAle,i12,165,80,135/85,210,follow up,2023-08-10,55,1,135,85,210,165,80,29.38,3,8,follow up\nP008,08/25/2023,48,M,I10,172,78,118/78,195,annual check,2023-08-25,48,0,118,78,195,172,78,26.39,1,8,annual check\nP009,2023-09-01,50,Male,i10,,82,130/88,,urgent,2023-09-01,50,0,130,88,198,172,82,27.72,1,9,urgent\nP010,09/10/2023,42,F,i11,169,74,125/80,205,follow-up,2023-09-10,42,1,125,80,205,169,74,25.90,2,9,follow-up\nP011,2023/10/05,,Male,i12,174,,120/80,198,,2023-10-05,48,0,120,80,198,174,75,24.79,3,10,no notes\nP012,10-15-2023,35,F,I10,165,67,110/70,185,check up,2023-10-15,35,1,110,70,185,165,67,24.63,1,10,check up"}
{"purpose": "Engineer features from student performance and attendance data to predict course completion likelihood.", "raw_table": "student_id,name,enrollment_date,last_access,attendance_pct,avg_quiz_score,final_grade,major\nS001,john DOE,2023-01-15,03/20/2023,85%,88, B,Computer science\nS002,Alice smith,15-02-2023,2023/04/01,NaN,72,A,computer Science\nS003,BOB johnson,2023-03-01,03-28-2023, ninety, 65,C,Engineering\nS004,carol White,2023/01/10,,92%,95,A,engineering\nS005,daniel lee,2023-02-20,2023-03-30,88%,missing,B,computer science\nS006,Eva Brown,2023/01/25,2023-04-05,80%,78,C,Computer Science\nS007,Fred Black,2023-02-28,2023-03-25,75%,85,B,Engineering\nS008,Gina Green,2023-03-10,2023-04-02,82%,,A,computer science\nS009,Henry Gold,2023-01-30,03/31/2023,83%,70,C,engineering\nS010,Ivy Silver,,2023-04-01,89%,90,A,Computer science", "fe_steps": ["Standardize enrollment_date and last_access columns to ISO date format (YYYY-MM-DD)", "Fill missing attendance_pct values with the average attendance percentage", "Convert attendance_pct from percentage strings or words to numeric float values", "Impute missing avg_quiz_score values with median quiz score", "Standardize major column capitalization and unify variants (e.g., 'computer science')", "Extract days_since_enrollment as difference between last_access and enrollment_date", "One-hot encode the major column", "Map final_grade from letter grades to numeric scale (A=4, B=3, C=2, missing=0)", "Extract name_length as number of characters in the student's name", "Create a binary feature completed_course indicating if final_grade numeric >= 3"], "fe_table": "student_id,name,enrollment_date,last_access,attendance_pct,avg_quiz_score,final_grade,major,enrollment_date_iso,last_access_iso,attendance_pct_num,avg_quiz_score_imputed,major_std,days_since_enrollment,major_Computer Science,major_Engineering,final_grade_num,name_length,completed_course\nS001,john DOE,2023-01-15,03/20/2023,85%,88, B,Computer science,2023-01-15,2023-03-20,85.0,88,computer science,64,1,0,3,8,1\nS002,Alice smith,15-02-2023,2023/04/01,NaN,72,A,computer Science,2023-02-15,2023-04-01,82.9,72,computer science,45,1,0,4,11,1\nS003,BOB johnson,2023-03-01,03-28-2023, ninety, 65,C,Engineering,2023-03-01,2023-03-28,82.9,65,engineering,27,0,1,2,11,0\nS004,carol White,2023/01/10,,92%,95,A,engineering,2023-01-10,,92.0,95,engineering,,0,1,4,11,1\nS005,daniel lee,2023-02-20,2023-03-30,88%,missing,B,computer science,2023-02-20,2023-03-30,88.0,78,computer science,38,1,0,3,10,1\nS006,Eva Brown,2023-01-25,2023-04-05,80%,78,C,Computer Science,2023-01-25,2023-04-05,80.0,78,computer science,70,1,0,2,9,0\nS007,Fred Black,2023-02-28,2023-03-25,75%,85,B,Engineering,2023-02-28,2023-03-25,75.0,85,engineering,25,0,1,3,10,1\nS008,Gina Green,2023-03-10,2023-04-02,82%,,A,computer science,2023-03-10,2023-04-02,82.0,78,computer science,23,1,0,4,10,1\nS009,Henry Gold,2023-01-30,03/31/2023,83%,70,C,engineering,2023-01-30,2023-03-31,83.0,70,engineering,60,0,1,2,10,0\nS010,Ivy Silver,,2023-04-01,89%,90,A,Computer science,,2023-04-01,89.0,90,computer science,,1,0,4,10,1"}
{"purpose": "Engineer clean and model-ready features from raw climate sensor data to predict daily temperature variations.", "raw_table": "StationID,Date,Temperature,Humidity,WindSpeed,WeatherCondition\nS001,2023/03/01,15.2,55%,12 km/h,Sunny\ns002,03-02-2023,14.8,60,8 km/h,cloudy\nS003,2023-03-03,not available,58%,15km/h,Rain\nS001,3/4/2023,16.1,57%,13 km/h,Sunny\nS002,2023/03/05,14.9,,10 km/h,Cloudy\nS003,2023-03-06,13.5,59%,N/A,Rain\ns001,2023/03/07,15.8,56%,14 km/h,Sunny\nS002,03-08-2023,missing,61%,9 km/h,Fog\nS003,2023-03-09,13.8,60%,16 km/h,Rain\nS001,2023/3/10,16.3,55%,12 km/h,Sunny\n", "fe_steps": ["Standardize the Date column to YYYY-MM-DD format", "Fill missing Temperature values with the median temperature per StationID", "Convert Humidity from percentage strings to numeric values", "Extract day_of_week and month from the Date column", "Parse WindSpeed to numeric km/h values, filling missing or 'N/A' with the median wind speed", "Normalize WeatherCondition to lowercase and unify variants (e.g., 'cloudy' and 'Cloudy' to 'cloudy')", "One-hot encode the WeatherCondition categorical variable", "Create a new feature Temperature_Fahrenheit from Temperature in Celsius", "Calculate Temperature difference from the previous day per StationID", "Standardize numeric columns: Temperature, Humidity, WindSpeed, Temperature_Fahrenheit, Temperature difference"], "fe_table": "StationID,Date,Temperature,Humidity,WindSpeed,WeatherCondition,day_of_week,month,weather_sunny,weather_cloudy,weather_rain,weather_fog,Temperature_Fahrenheit,Temp_Diff_Station,Temperature_std,Humidity_std,WindSpeed_std,Temperature_Fahrenheit_std,Temp_Diff_std\nS001,2023-03-01,15.2,55,12,Sunny,Wednesday,3,1,0,0,0,59.36,0,0.19,-0.68,0.24,0.19,NaN\ns002,2023-03-02,14.8,60,8,cloudy,Thursday,3,0,1,0,0,58.64,-0.4,-0.24,0.18,-1.11,-0.24,-0.56\nS003,2023-03-03,14.9,58,15,Rain,Friday,3,0,0,1,0,58.82,NaN,-0.19,-0.12,1.19,-0.19,NaN\nS001,2023-03-04,16.1,57,13,Sunny,Saturday,3,1,0,0,0,60.98,0.9,0.62,-0.26,0.71,0.62,1.68\nS002,2023-03-05,14.9,59,10,cloudy,Sunday,3,0,1,0,0,58.82,0.1,-0.19,0.07,-0.43,-0.19,0.28\nS003,2023-03-06,13.5,59,12,Rain,Monday,3,0,0,1,0,56.30,-1.4,-1.13,0.07,0.24,-1.13,-1.97\ns001,2023-03-07,15.8,56,14,Sunny,Tuesday,3,1,0,0,0,60.44,-0.3,0.38,-0.39,0.95,0.38,-0.56\nS002,2023-03-08,14.9,61,9,Fog,Wednesday,3,0,0,0,1,58.82,-0, -0.19,0.33,-0.81,-0.19,-0.01\nS003,2023-03-09,13.8,60,16,Rain,Thursday,3,0,0,1,0,56.84,0.3,-0.86,0.25,1.62,-0.86,0.28\nS001,2023-03-10,16.3,55,12,Sunny,Friday,3,1,0,0,0,61.34,0.5,0.77,-0.68,0.24,0.77,0.84\n"}
{"purpose": "Engineer features from citizen complaint records to predict complaint resolution time.", "raw_table": "Complaint_ID,Received_Date,Department,Complaint_Type,Priority,Status,Resolution_Time_days\n1001,2023/01/15,Public works,Noise,High,Closed,5\n1002,15-02-2023,public Works,noise,Medium,closed,seven\n1003,2023-03-05,Health Dept,Sanitation,Low,Open,\n1004,04/04/2023,health dept,Sanitation,low,Closed,3\n1005,2023-05-20,Transport,Traffic,High,In Progress,NA\n1006,2023/06/01,Transport,traffic,Medium,Closed,4\n1007,07-07-2023,Public Works,Noise,High,Closed,6 days\n1008,,Health Dept,Sanitation,Medium,Closed,2\n1009,2023/08/10,Transport,traffic,High,Closed,8\n1010,2023-09-15,public works,Noise,Low,Open,\n1011,10/10/2023,Health Dept,Sanitation,Medium,Closed,5\n1012,11-11-2023,Transport,Traffic,medium,Closed,3\n1013,2023/12/01,Public Works,Noise,High,Closed,4\n", "fe_steps": ["Standardize Received_Date to ISO format (YYYY-MM-DD)", "Fill missing Received_Date with the median Received_Date", "Convert Priority to title case and map to numeric scale: Low=1, Medium=2, High=3", "Normalize Department names to title case without extra spaces", "Correct Complaint_Type capitalization to title case", "Convert Resolution_Time_days to numeric, handling string representations and missing values by imputing median resolution time", "Extract month and day_of_week from Received_Date", "Create binary feature Is_Closed indicating if Status is 'Closed'", "Create feature Resolution_Time_logged by applying log transform to Resolution_Time_days +1", "One-hot encode Department", "Bucketize Resolution_Time_days into categories: Fast (<=3), Moderate (4-6), Slow (>6)"], "fe_table": "Complaint_ID,Received_Date,Department,Complaint_Type,Priority,Status,Resolution_Time_days,Received_Date_ISO,Priority_Numeric,Department_Normalized,Complaint_Type_Normalized,Resolution_Time_Numeric,Month,Day_of_Week,Is_Closed,Resolution_Time_Logged,Dept_Public_Works,Dept_Health_Dept,Dept_Transport,Resolution_Speed\n1001,2023/01/15,Public works,Noise,High,Closed,5,2023-01-15,3,Public Works,Noise,5,1,Sunday,1,1.79,1,0,0,Moderate\n1002,15-02-2023,public Works,noise,Medium,closed,seven,2023-02-15,2,Public Works,Noise,7,2,Wednesday,1,2.08,1,0,0,Slow\n1003,2023-03-05,Health Dept,Sanitation,Low,Open,,2023-03-05,1,Health Dept,Sanitation,4,3,Sunday,0,1.61,0,1,0,Moderate\n1004,04/04/2023,health dept,Sanitation,low,Closed,3,2023-04-04,1,Health Dept,Sanitation,3,4,Tuesday,1,1.39,0,1,0,Fast\n1005,2023-05-20,Transport,Traffic,High,In Progress,NA,2023-05-20,3,Transport,Traffic,4,5,Saturday,0,1.61,0,0,1,Moderate\n1006,2023/06/01,Transport,traffic,Medium,Closed,4,2023-06-01,2,Transport,Traffic,4,6,Thursday,1,1.61,0,0,1,Moderate\n1007,07-07-2023,Public Works,Noise,High,Closed,6 days,2023-07-07,3,Public Works,Noise,6,7,Friday,1,1.95,1,0,0,Moderate\n1008,,Health Dept,Sanitation,Medium,Closed,2,2023-06-15,2,Health Dept,Sanitation,2,6,Thursday,1,1.10,0,1,0,Fast\n1009,2023/08/10,Transport,traffic,High,Closed,8,2023-08-10,3,Transport,Traffic,8,8,Thursday,1,2.20,0,0,1,Slow\n1010,2023-09-15,public works,Noise,Low,Open,,2023-09-15,1,Public Works,Noise,4,9,Friday,0,1.61,1,0,0,Moderate\n1011,10/10/2023,Health Dept,Sanitation,Medium,Closed,5,2023-10-10,2,Health Dept,Sanitation,5,10,Tuesday,1,1.79,0,1,0,Moderate\n1012,11-11-2023,Transport,Traffic,medium,Closed,3,2023-11-11,2,Transport,Traffic,3,11,Saturday,1,1.39,0,0,1,Fast\n1013,2023/12/01,Public Works,Noise,High,Closed,4,2023-12-01,3,Public Works,Noise,4,12,Friday,1,1.61,1,0,0,Moderate"}
{"purpose": "Engineer features from student attendance and assignment data to predict course completion likelihood.", "raw_table": "Student_ID,Name,Enrollment_Date,Last_Login,Attendance_Percentage,Assignment_Score,Major,Status\nS001,alice johnson,2023/01/15,3/25/2023,85%,88,computer science,active\nS002,Bob Smith,15-02-2023,2023-03-20,92,92.5,Comp Sci,Active\nS003,carol Lee,2023-01-28,March 10 2023,missing,75,Computer Science,Active\nS004,DAVE WONG,2023/02/05,03/22/2023,78%,Incomplete,computer science,active\nS005,Erin O'Neil,2023-01-20,3/15/23,67%,65,comp sci,Inactive\nS006,Frank MOORE,01/25/2023,2023-03-18,82,85,COMPUTER SCIENCE,Active\nS007,Gina Chen,2023/02/10,,90%,90,ComputerScience,Active\nS008,Harry Miles,2023-02-12,03-19-2023,missing,missing,computer science,Inactive\nS009,Ivy Tran,2023/01/30,2023-03-21,88%,89,Computer Science,active\nS010,Jackie Ray,2023-02-01,3-18-2023,95,93,CompSci,Active", "fe_steps": ["Standardize Enrollment_Date and Last_Login columns to ISO date format YYYY-MM-DD", "Fill missing Attendance_Percentage with the average attendance of the dataset", "Convert Attendance_Percentage from string percentage to float between 0 and 1", "Convert Assignment_Score to float and replace 'Incomplete' or 'missing' with median score", "Normalize Major field to consistent lowercase 'computer science'", "Map Status to binary: 'active' as 1, 'inactive' as 0", "Calculate Days_Since_Last_Login as difference in days between 2023-03-26 and Last_Login", "Create binary feature Assignment_Completed: 1 if Assignment_Score >= 70 else 0", "Bucketize Attendance_Percentage into 'Low', 'Medium', 'High' attendance categories"], "fe_table": "Student_ID,Name,Enrollment_Date,Last_Login,Attendance_Percentage,Assignment_Score,Major,Status,Enrollment_Date_ISO,Last_Login_ISO,Attendance_Float,Assignment_Score_Float,Major_Std,Status_Binary,Days_Since_Last_Login,Assignment_Completed,Attendance_Category\nS001,alice johnson,2023/01/15,3/25/2023,85%,88,computer science,active,2023-01-15,2023-03-25,0.85,88.0,computer science,1,1,1,High\nS002,Bob Smith,15-02-2023,2023-03-20,92,92.5,Comp Sci,Active,2023-02-15,2023-03-20,0.92,92.5,computer science,1,6,1,High\nS003,carol Lee,2023-01-28,March 10 2023,0.83,75,Computer Science,Active,2023-01-28,2023-03-10,0.83,75.0,computer science,1,16,1,Medium\nS004,DAVE WONG,2023/02/05,03/22/2023,78%,79,computer science,active,2023-02-05,2023-03-22,0.78,79.0,computer science,1,4,1,Medium\nS005,Erin O'Neil,2023-01-20,3/15/23,67%,65,comp sci,Inactive,2023-01-20,2023-03-15,0.67,65.0,computer science,0,11,0,Low\nS006,Frank MOORE,01/25/2023,2023-03-18,82,85,COMPUTER SCIENCE,Active,2023-01-25,2023-03-18,0.82,85.0,computer science,1,8,1,Medium\nS007,Gina Chen,2023/02/10,,90%,90,ComputerScience,Active,2023-02-10,2023-03-18,0.90,90.0,computer science,1,8,1,High\nS008,Harry Miles,2023-02-12,03-19-2023,0.83,79,computer science,Inactive,2023-02-12,2023-03-19,0.83,79.0,computer science,0,7,1,Medium\nS009,Ivy Tran,2023/01/30,2023-03-21,88%,89,Computer Science,active,2023-01-30,2023-03-21,0.88,89.0,computer science,1,5,1,High\nS010,Jackie Ray,2023-02-01,3-18-2023,95,93,CompSci,Active,2023-02-01,2023-03-18,0.95,93.0,computer science,1,8,1,High"}
{"purpose": "Engineer clean and model-ready features for predicting house sale prices in the real estate market.", "raw_table": "ListingID,DateListed,Location,PropertyType,Bedrooms,Bathrooms,SizeSqFt,Price\n1001,2023-01-15,New york,Apartment,2,1,850,450K\n1002,15/02/2023,los Angeles,house,3,2,1200,650000\n1003,2023/03/01,Chicago,Condo,2,,900,500000\n1004,2023-04-20,NEW YORK,apartment,1,1,,400000\n1005,05-05-2023,Houston,House,4,3,2000,1.2M\n1006,2023-06-10,Los angeles,House,,2,1500,700000\n1007,2023-07-01,Chicago,Condo,3,2,1100,\"$550,000\"\n1008,2023-07-15,Houston,House,3,2,1800,NaN\n1009,2023/08/01,New York,Apartment,2,1,850,460000\n1010,08/15/2023,los angeles,House,3,2,1500,720000\n1011,2023-09-01,Houston,house,4,3,2100,1,250,000\n1012,2023-09-15,Chicago,Condo,2,1,950,530000", "fe_steps": ["Standardize DateListed to ISO format yyyy-mm-dd", "Normalize Location names to title case", "Impute missing Bedrooms and Bathrooms using median values by PropertyType", "Convert Price to numeric values in dollars (handle K, M, commas, and stray characters)", "Fill missing SizeSqFt with median size by PropertyType", "Create PricePerSqFt by dividing Price by SizeSqFt", "One-hot encode PropertyType", "Extract MonthListed from DateListed", "Bucketize Bedrooms into categories: 'Small'(1-2), 'Medium'(3), 'Large'(4+)", "Standardize numeric columns: SizeSqFt, Price, PricePerSqFt"], "fe_table": "ListingID,DateListed,Location,PropertyType,Bedrooms,Bathrooms,SizeSqFt,Price,PricePerSqFt,MonthListed,PropertyType_Apartment,PropertyType_Condo,PropertyType_House,BedroomCategory\n1001,2023-01-15,New York,Apartment,2,1,850,450000,529.41,1,1,0,0,Small\n1002,2023-02-15,Los Angeles,House,3,2,1200,650000,541.67,2,0,0,1,Medium\n1003,2023-03-01,Chicago,Condo,2,2,900,500000,555.56,3,0,1,0,Small\n1004,2023-04-20,New York,Apartment,1,1,975,400000,410.26,4,1,0,0,Small\n1005,2023-05-05,Houston,House,4,3,2000,1200000,600.00,5,0,0,1,Large\n1006,2023-06-10,Los Angeles,House,3,2,1500,700000,466.67,6,0,0,1,Medium\n1007,2023-07-01,Chicago,Condo,3,2,1100,550000,500.00,7,0,1,0,Medium\n1008,2023-07-15,Houston,House,3,2,1800,715000,397.22,7,0,0,1,Medium\n1009,2023-08-01,New York,Apartment,2,1,850,460000,541.18,8,1,0,0,Small\n1010,2023-08-15,Los Angeles,House,3,2,1500,720000,480.00,8,0,0,1,Medium\n1011,2023-09-01,Houston,House,4,3,2100,1250000,595.24,9,0,0,1,Large\n1012,2023-09-15,Chicago,Condo,2,1,950,530000,557.89,9,0,1,0,Small"}
{"purpose": "Engineer features from raw social media user activity data to predict user engagement levels.", "raw_table": "user_id,post_date,post_time,post_type,likes,comments,shares,device_type\n101,2023/03/01,14:35,Image,120,15,5,Mobile\n102,03-02-2023,09:20,video,300,45,,Desktop\n103,2023-03-03,18:00,Text,50,N/A,0,mobile\n104,Mar 4 2023,12:00,IMAGE,NaN,10,2,Tablet\n105,2023/03/05,20:15,Video,200,20,10,desktop\n106,2023-03-06,07:45,text,30,5,1,Mobile\n107,03/07/2023,23:30,Image,Na,8,3,Tablet\n108,2023-3-08,15:10,video,400,50,12,Mobile\n109,2023/03/09,11:00,Text,25,3,0,Desktop\n110,2023-03-10,16:20,Image,130,NaN,4,mobile\n111,Mar 11 2023,10:00,Video,350,55,15,Mobile\n112,2023/03/12,,Text,40,4,NaN,Desktop", "fe_steps": ["Standardize post_date to ISO format YYYY-MM-DD", "Fill missing likes, comments, and shares with zero", "Convert post_type to lowercase and one-hot encode it", "Extract day_of_week from post_date", "Calculate total_engagement as sum of likes, comments, and shares", "Create is_mobile_device flag where device_type indicates 'mobile'", "Fill missing post_time with median post_time and convert to hour of day", "Bucketize total_engagement into Low, Medium, High engagement groups"], "fe_table": "user_id,post_date,post_time,post_type,likes,comments,shares,device_type,post_type_image,post_type_text,post_type_video,day_of_week,total_engagement,is_mobile_device,post_hour,engagement_bucket\n101,2023-03-01,14:35,image,120,15,5,Mobile,1,0,0,3,140,1,14,Medium\n102,2023-03-02,09:20,video,300,45,0,Desktop,0,0,1,4,345,0,9,High\n103,2023-03-03,18:00,text,50,0,0,mobile,0,1,0,5,50,1,18,Low\n104,2023-03-04,12:00,image,0,10,2,Tablet,1,0,0,6,12,0,12,Low\n105,2023-03-05,20:15,video,200,20,10,desktop,0,0,1,7,230,0,20,High\n106,2023-03-06,07:45,text,30,5,1,Mobile,0,1,0,1,36,1,7,Low\n107,2023-03-07,23:30,image,0,8,3,Tablet,1,0,0,2,11,0,23,Low\n108,2023-03-08,15:10,video,400,50,12,Mobile,0,0,1,3,462,1,15,High\n109,2023-03-09,11:00,text,25,3,0,Desktop,0,1,0,4,28,0,11,Low\n110,2023-03-10,16:20,image,130,0,4,mobile,1,0,0,5,134,1,16,Medium\n111,2023-03-11,10:00,video,350,55,15,Mobile,0,0,1,6,420,1,10,High\n112,2023-03-12,12:00,text,40,4,0,Desktop,0,1,0,7,44,0,12,Low"}
{"purpose": "Engineer robust features to predict vehicle arrival delays based on trip and driver characteristics.", "raw_table": "Trip_ID,Driver_Name,Start_Location,End_Location,Start_Date,Start_Time,Vehicle_Type,Distance_km,Traffic_Condition,Reported_Delay\nT001,alice JOHNSON,New York,Los Angeles,2023-04-01,08:30 AM,sedan,4500,Heavy,15\nT002,Bob smith,new york,San Francisco,04/02/2023,09:00,Truck,4700,medium, 20mins\nT003,Charlie,Chicago,los angeles,2023/04/03,07:45 am,SUV,abc,Light,0\nT004,David Lee,Los Angeles,Chicago,2023-04-04,6:15 PM,SUV,2800,heavy,unknown\nT005,ellen NGuyen,San Francisco,New york,4-5-2023,10:00 AM,Truck,4700,moderate,30\nT006,Frank O'connor,Chicago,New york,2023-04-06,11:30,sedan,1300,,10\nT007,Grace Li,Los Angeles,San Francisco,2023-04-07,08:00 AM,SUV,600,Light,5\nT008,Henry KIM,New York,Chicago,2023/04/08,14:00,sedan,1300,Medium,25\nT009,Ivy Chen,San Francisco,Los Angeles,2023-04-09,07:00 am,truck,600,Moderate,15\nT010,Jack ma,Los angeles,Chicago,2023-04-10,5:30 PM,SUV,2800,Heavy,20\n", "fe_steps": ["Standardize Driver_Name to title case", "Normalize Start_Location and End_Location to title case", "Convert Start_Date to ISO format YYYY-MM-DD", "Extract day_of_week from Start_Date", "Convert Start_Time to 24-hour format", "Clean Distance_km by replacing non-numeric with NaN and imputing with median", "Standardize Traffic_Condition categories to three levels: Light, Medium, Heavy", "Convert Reported_Delay to numeric minutes, removing text and handling 'unknown' as zero", "One-hot encode Vehicle_Type", "Create a feature trip_duration_estimate as Distance_km divided by average speed per Vehicle_Type (sedan=80 km/h, suv=70 km/h, truck=60 km/h)"], "fe_table": "Trip_ID,Driver_Name,Start_Location,End_Location,Start_Date,Start_Time,Vehicle_Type,Distance_km,Traffic_Condition,Reported_Delay,Day_of_Week,Start_Time_24h,Reported_Delay_Minutes,Distance_km_Clean,Traffic_Level_Light,Traffic_Level_Medium,Traffic_Level_Heavy,Vehicle_Sedan,Vehicle_SUV,Vehicle_Truck,Trip_Duration_Estimate\nT001,Alice Johnson,New York,Los Angeles,2023-04-01,08:30 AM,Sedan,4500,Heavy,15,Saturday,08:30,15,4500,0,0,1,1,0,0,56.25\nT002,Bob Smith,New York,San Francisco,2023-04-02,09:00 AM,Truck,4700,Medium,20,Sunday,09:00,20,4700,0,1,0,0,0,1,78.33\nT003,Charlie,Chicago,Los Angeles,2023-04-03,07:45 AM,SUV,NaN,Light,0,Monday,07:45,0,2800,1,0,0,0,1,0,40.0\nT004,David Lee,Los Angeles,Chicago,2023-04-04,18:15,SUV,2800,Heavy,0,Tuesday,18:15,0,2800,0,0,1,0,1,0,40.0\nT005,Ellen Nguyen,San Francisco,New York,2023-04-05,10:00 AM,Truck,4700,Medium,30,Wednesday,10:00,30,4700,0,1,0,0,0,1,78.33\nT006,Frank O'Connor,Chicago,New York,2023-04-06,11:30 AM,Sedan,1300,Medium,10,Thursday,11:30,10,1300,0,1,0,1,0,0,16.25\nT007,Grace Li,Los Angeles,San Francisco,2023-04-07,08:00 AM,SUV,600,Light,5,Friday,08:00,5,600,1,0,0,0,1,0,8.57\nT008,Henry Kim,New York,Chicago,2023-04-08,14:00,Sedan,1300,Medium,25,Saturday,14:00,25,1300,0,1,0,1,0,0,16.25\nT009,Ivy Chen,San Francisco,Los Angeles,2023-04-09,07:00 AM,Truck,600,Medium,15,Sunday,07:00,15,600,0,1,0,0,0,1,10.0\nT010,Jack Ma,Los Angeles,Chicago,2023-04-10,17:30,SUV,2800,Heavy,20,Monday,17:30,20,2800,0,0,1,0,1,0,40.0\n"}
{"purpose": "Engineer features from raw trip data to improve accuracy of trip duration prediction models.", "raw_table": "TripID,Start_Date,End_Date,Start_Location,End_Location,Vehicle_Type,Distance_km,Driver_Rating\nT001,2023/04/01,04-01-2023 08:45,New York,los angeles,Sedan, 450.5,4.8\nT002,04-02-2023,2023-04-02 09:10,Chicago,Chicago,SUV,abc,4.5\nT003,2023-04-03,2023/04/03 10:15,houston,Miami,sedan, 1500.3,NA\nT004,04/04/2023,,San Francisco,Seattle,TRUCK,1300,4.9\nT005,2023-04-05,2023-04-05 14:00,miami,New York,suv, 1300.7,5\nT006,2023-04-06,2023-04-06 16:45,Los Angeles,San Francisco,Sedan,600.2,4.6\nT007,2023.04.07,2023-04-07 12:00,Chicago,Houston,sedan,1100,4.7\nT008,2023/04/08,2023-04-08 18:30,Seattle,Portland,Truck,300.5,4.2\nT009,04-09-2023,04-09-2023 20:15,Portland,San Francisco,SUV,670,3.9\nT010,2023-04-10 07:00,2023-04-10 11:30,New York,Boston,Sedan,340.8,4.1", "fe_steps": ["Normalize all date columns (Start_Date, End_Date) to ISO 8601 format (YYYY-MM-DD HH:MM)", "Calculate trip_duration_minutes as difference between End_Date and Start_Date in minutes", "Convert Vehicle_Type to lowercase and standardize categories to Sedan, SUV, or Truck", "Replace missing or invalid Distance_km values with median Distance_km", "Convert Driver_Rating to float and replace missing ratings with median rating", "Create a binary feature is_long_trip indicating if Distance_km is greater than 1000 km", "Extract start_day_of_week from normalized Start_Date", "One-hot encode Vehicle_Type", "Standardize numeric columns: Distance_km, Driver_Rating, trip_duration_minutes"], "fe_table": "TripID,Start_Date,End_Date,Start_Location,End_Location,Vehicle_Type,Distance_km,Driver_Rating,Start_Date_ISO,End_Date_ISO,trip_duration_minutes,vehicle_type_clean,Distance_km_filled,Driver_Rating_filled,is_long_trip,start_day_of_week,Vehicle_Type_Sedan,Vehicle_Type_SUV,Vehicle_Type_Truck,Distance_km_std,Driver_Rating_std,trip_duration_minutes_std\nT001,2023/04/01,04-01-2023 08:45,New York,los angeles,Sedan, 450.5,4.8,2023-04-01 00:00,2023-04-01 08:45,525,Sedan,450.5,4.8,0,6,1,0,0,-0.645,0.490,-0.311\nT002,04-02-2023,2023-04-02 09:10,Chicago,Chicago,SUV,abc,4.5,2023-04-02 00:00,2023-04-02 09:10,550,SUV,670.0,4.5,0,7,0,1,0,-0.027,-0.109,-0.249\nT003,2023-04-03,2023/04/03 10:15,houston,Miami,sedan, 1500.3,NA,2023-04-03 00:00,2023-04-03 10:15,615,Sedan,1500.3,4.6,1,1,1,0,0,2.014,-0.001,-0.138\nT004,04/04/2023,,San Francisco,Seattle,TRUCK,1300,4.9,2023-04-04 00:00,2023-04-04 00:00,0,Truck,1300.0,4.9,1,2,0,0,1,1.559,0.599,-0.506\nT005,2023-04-05,2023-04-05 14:00,miami,New York,suv, 1300.7,5,2023-04-05 00:00,2023-04-05 14:00,840,SUV,1300.7,5.0,1,3,0,1,0,1.561,1.096,0.095\nT006,2023-04-06,2023-04-06 16:45,Los Angeles,San Francisco,Sedan,600.2,4.6,2023-04-06 00:00,2023-04-06 16:45,1005,Sedan,600.2,4.6,0,4,1,0,0,-0.465,-0.001,0.577\nT007,2023.04.07,2023-04-07 12:00,Chicago,Houston,sedan,1100,4.7,2023-04-07 00:00,2023-04-07 12:00,720,Sedan,1100.0,4.7,1,5,1,0,0,1.034,0.244,0.010\nT008,2023/04/08,2023-04-08 18:30,Seattle,Portland,Truck,300.5,4.2,2023-04-08 00:00,2023-04-08 18:30,1110,Truck,300.5,4.2,0,6,0,0,1, -0.825,-0.797,0.711\nT009,04-09-2023,04-09-2023 20:15,Portland,San Francisco,SUV,670,3.9,2023-04-09 00:00,2023-04-09 20:15,1215,SUV,670.0,3.9,0,0,0,1,0,-0.027,-1.553,0.940\nT010,2023-04-10 07:00,2023-04-10 11:30,New York,Boston,Sedan,340.8,4.1,2023-04-10 07:00,2023-04-10 11:30,270,Sedan,340.8,4.1,0,1,1,0,0,-0.894,-1.099,-1.095"}
{"purpose": "Engineer features from raw climate data to improve prediction of daily maximum temperature.", "raw_table": "StationID,Date,Precipitation(mm),WindSpeed(km/h),SkyCondition,TempMax(C)\nST001,2023/04/01,5.2,15,Clear,22\nst001,04-02-2023,0,,cloudy,21.5\nST002,2023-4-01,missing,20,Partly Cloudy,19\nST003,2023/04/01,3.1,12,clear,not recorded\nST002,04/03/2023,0.0,18,Cloudy,20\nST001,2023-04-04,7,14,clear,23\nSt003,2023-04-02,NA,10,partly cloudy,20\nST001,2023/04/05,0.5,11,Clear,21\nst002,04-05-2023,2.3,15,CLOUDY,22\nST003,04/04/2023,0,9,Clear,19\nST001,2023/04/06,1.2,missing,Cloudy,22\nST002,2023/04/06,0,13,Cloudy,21\nST003,04-05-2023,3.0,11,clear,20", "fe_steps": ["Standardize Date column to ISO format YYYY-MM-DD", "Fill missing WindSpeed values with the median WindSpeed", "Convert Precipitation(mm) to numeric and impute missing or non-numeric as zero", "Normalize StationID to uppercase", "Map SkyCondition variants to three categories: Clear, Cloudy, Partly Cloudy", "Extract day_of_week from Date", "Create a binary feature PrecipitationFlag indicating if precipitation > 0", "Calculate WindSpeed_kmh_to_mph by converting km/h to mph", "Fill missing TempMax(C) by forward filling within each StationID", "Bucketize TempMax(C) into Low (<20), Moderate (20-22), High (>22)"], "fe_table": "StationID,Date,Precipitation(mm),WindSpeed(km/h),SkyCondition,TempMax(C),day_of_week,PrecipitationFlag,WindSpeed_mph,SkyCondition_Cat,TempMax_Bucket\nST001,2023-04-01,5.2,15,Clear,22,Saturday,1,9.32,Clear,Moderate\nST001,2023-04-02,0.0,13,Cloudy,21.5,Sunday,0,8.08,Cloudy,Moderate\nST002,2023-04-01,0.0,20,Partly Cloudy,19,Saturday,0,12.43,Partly Cloudy,Low\nST003,2023-04-01,3.1,12,Clear,20,Saturday,1,7.46,Clear,Moderate\nST002,2023-04-03,0.0,18,Cloudy,20,Monday,0,11.18,Cloudy,Moderate\nST001,2023-04-04,7.0,14,Clear,23,Tuesday,1,8.70,Clear,High\nST003,2023-04-02,0.0,10,Partly Cloudy,20,Sunday,0,6.21,Partly Cloudy,Moderate\nST001,2023-04-05,0.5,11,Clear,21,Wednesday,1,6.84,Clear,Moderate\nST002,2023-04-05,2.3,15,Cloudy,22,Wednesday,1,9.32,Cloudy,Moderate\nST003,2023-04-04,0.0,9,Clear,19,Tuesday,0,5.59,Clear,Low\nST001,2023-04-06,1.2,13,Cloudy,22,Thursday,1,8.08,Cloudy,Moderate\nST002,2023-04-06,0.0,13,Cloudy,21,Thursday,0,8.08,Cloudy,Moderate\nST003,2023-04-05,3.0,11,Clear,20,Wednesday,1,6.84,Clear,Moderate"}
{"purpose": "Engineer features from raw social media post data to predict post engagement levels.", "raw_table": "post_id,user_id,post_text,post_date,likes,comments,shares,post_type\n1,User_01,\"Love this! #fun\",2023-04-01,12,3,1,Image\n2,USER_02,\"Check out my blog\",04/02/2023,5,0,0,Text\n3,user_03,\"New product launch!!!\",2023/04/03,15,5,2,Video\n4,User_04,\"happy friday everyone\",April 4 2023,,2,1,image\n5,USER_05,\"join us @event\",2023-04-05,NaN,NaN,NaN,Text\n6,user_06,,2023-04-06,7,1,0,text\n7,User_07,\"Throwback Thursday #tbt\",4-7-2023,20,8,5,Image\n8,user_08,\"Sale ends soon!\",2023-04-08,abc,3,1,Video\n9,user_09,\"Check this out\",2023-04-09,8,2,NaN,text\n10,User_10,\"Good morning\",2023.04.10,10,,0,Image\n11,USER_11,\"Weekend vibes\",2023-4-11,9,1,2,video\n12,user_12,\"Happy Holidays!\",13 Apr 2023,25,10,4,IMAGE\n13,user_13,\"New blog post\",2023/14/04,4,0,1,Text\n14,User_14,\"Follow for updates\",2023-04-15,6,1,1,text\n15,user_15,\"Check this out\",15-04-2023,NaN,NaN,NaN,Video", "fe_steps": ["Standardize user_id to uppercase.", "Parse post_date into a consistent YYYY-MM-DD format.", "Fill missing values in likes, comments, and shares with zero.", "Convert likes, comments, and shares columns to numeric types, coercing invalid entries to zero.", "Extract day_of_week from post_date.", "Calculate total_engagement as the sum of likes, comments, and shares.", "Create a binary feature has_text indicating if post_text is present.", "Normalize post_type to lowercase and one-hot encode it.", "Count number of hashtags in post_text as hashtag_count.", "Bucket total_engagement into three levels: low (0-5), medium (6-15), high (>15)."], "fe_table": "post_id,user_id,post_text,post_date,likes,comments,shares,post_type,user_id_upper,post_date_std,likes_num,comments_num,shares_num,day_of_week,total_engagement,has_text,post_type_image,post_type_text,post_type_video,hashtag_count,engagement_level\n1,User_01,\"Love this! #fun\",2023-04-01,12,3,1,Image,USER_01,2023-04-01,12,3,1,Saturday,16,1,1,0,0,1,high\n2,USER_02,\"Check out my blog\",04/02/2023,5,0,0,Text,USER_02,2023-04-02,5,0,0,Sunday,5,1,0,1,0,0,low\n3,user_03,\"New product launch!!!\",2023/04/03,15,5,2,Video,USER_03,2023-04-03,15,5,2,Monday,22,1,0,0,1,0,high\n4,User_04,\"happy friday everyone\",April 4 2023,0,2,1,image,USER_04,2023-04-04,0,2,1,Tuesday,3,1,1,0,0,0,low\n5,USER_05,\"join us @event\",2023-04-05,0,0,0,Text,USER_05,2023-04-05,0,0,0,Wednesday,0,1,0,1,0,0,low\n6,user_06,,2023-04-06,7,1,0,text,USER_06,2023-04-06,7,1,0,Thursday,8,0,0,1,0,0,medium\n7,User_07,\"Throwback Thursday #tbt\",4-7-2023,20,8,5,Image,USER_07,2023-04-07,20,8,5,Friday,33,1,1,0,0,1,high\n8,user_08,\"Sale ends soon!\",2023-04-08,0,3,1,Video,USER_08,2023-04-08,0,3,1,Saturday,4,1,0,0,1,0,low\n9,user_09,\"Check this out\",2023-04-09,8,2,0,text,USER_09,2023-04-09,8,2,0,Sunday,10,1,0,1,0,0,medium\n10,User_10,\"Good morning\",2023.04.10,10,0,0,Image,USER_10,2023-04-10,10,0,0,Monday,10,1,1,0,0,0,medium\n11,USER_11,\"Weekend vibes\",2023-4-11,9,1,2,video,USER_11,2023-04-11,9,1,2,Tuesday,12,1,0,0,1,0,medium\n12,user_12,\"Happy Holidays!\",13 Apr 2023,25,10,4,IMAGE,USER_12,2023-04-13,25,10,4,Thursday,39,1,1,0,0,0,high\n13,user_13,\"New blog post\",2023/14/04,4,0,1,Text,USER_13,2023-04-14,4,0,1,Friday,5,1,0,1,0,0,low\n14,User_14,\"Follow for updates\",2023-04-15,6,1,1,text,USER_14,2023-04-15,6,1,1,Saturday,8,1,0,1,0,0,medium\n15,user_15,\"Check this out\",15-04-2023,0,0,0,Video,USER_15,2023-04-15,0,0,0,Saturday,0,1,0,0,1,0,low"}
{"purpose": "Engineer features from movie viewing logs to predict user engagement levels.", "raw_table": "User_ID,Movie_Title,Genre,Watch_Date,Rating,Duration_Min,Device\n001,Inception,SCI-FI,2023/01/05,8,Fifty-five,Mobile\n002,The Godfather,Drama,05-02-2023,9,175,TV\n003,Avengers,Action,2023-02-15,NA,143,Laptop\n004,Parasite,drama,15-03-2023,8,132,Smartphone\n005,Interstellar,Sci-fi,03/20/2023,10,169,tablet\n006,Avatar,Action,,7,162,Smart TV\n007,Inception,Sci-Fi,2023/01/15,8.5,148,Mobile\n008,The Godfather,DRAMA,2023-02-05,,175,Tv\n009,Titanic,romance,02/14/2023,7,195,Laptop\n010,Avengers,Action,2023-02-16,8,143,Smartphone\n011,Parasite,Drama,2023-03-16,9,132,Tablet\n012,Interstellar,sci-Fi,March 23 2023,10,169,Smart TV\n013,Avatar,Action,2023/04/01,6,one hundred sixty two,TV\n014,Titanic,Romance,14-02-2023,7,195,smartphone", "fe_steps": ["Standardize Genre values to consistent capitalization (title case).", "Parse Watch_Date into ISO format (YYYY-MM-DD), filling missing dates with the mode date for that User_ID.", "Convert Duration_Min to numeric, replacing textual numbers and correcting invalid entries.", "Fill missing Rating values with the median rating of the same Genre.", "Create a binary feature 'High_Rating' indicating if Rating is 8 or above.", "Extract 'Watch_Month' and 'Watch_Weekday' from Watch_Date.", "Normalize Device names to a fixed set: Mobile, TV, Laptop, Tablet, Smart TV.", "Compute 'Rating_Duration_Ratio' as Rating divided by Duration_Min.", "One-hot encode the Genre column.", "Bucketize Duration_Min into three categories: Short (<120), Medium (120-160), Long (>160)."], "fe_table": "User_ID,Movie_Title,Genre,Watch_Date,Rating,Duration_Min,Device,Watch_Month,Watch_Weekday,High_Rating,Rating_Duration_Ratio,Genre_Sci-Fi,Genre_Drama,Genre_Action,Genre_Romance,Duration_Bucket,Device_Normalized\n001,Inception,Sci-Fi,2023-01-05,8.0,55,Mobile,1,Thursday,1,0.145,1,0,0,0,Short,Mobile\n002,The Godfather,Drama,2023-02-05,9.0,175,TV,2,Sunday,1,0.051,0,1,0,0,Long,TV\n003,Avengers,Action,2023-02-15,8.0,143,Laptop,2,Wednesday,1,0.056,0,0,1,0,Medium,Laptop\n004,Parasite,Drama,2023-03-15,8.0,132,Smartphone,3,Wednesday,1,0.061,0,1,0,0,Medium,Mobile\n005,Interstellar,Sci-Fi,2023-03-20,10.0,169,Tablet,3,Monday,1,0.059,1,0,0,0,Long,Tablet\n006,Avatar,Action,2023-03-16,7.0,162,Smart TV,3,Thursday,0,0.043,0,0,1,0,Long,Smart TV\n007,Inception,Sci-Fi,2023-01-15,8.5,148,Mobile,1,Sunday,1,0.057,1,0,0,0,Medium,Mobile\n008,The Godfather,Drama,2023-02-05,8.5,175,Tv,2,Sunday,1,0.049,0,1,0,0,Long,TV\n009,Titanic,Romance,2023-02-14,7.0,195,Laptop,2,Tuesday,0,0.036,0,0,0,1,Long,Laptop\n010,Avengers,Action,2023-02-16,8.0,143,Smartphone,2,Thursday,1,0.056,0,0,1,0,Medium,Mobile\n011,Parasite,Drama,2023-03-16,9.0,132,Tablet,3,Thursday,1,0.068,0,1,0,0,Medium,Tablet\n012,Interstellar,Sci-Fi,2023-03-23,10.0,169,Smart TV,3,Thursday,1,0.059,1,0,0,0,Long,Smart TV\n013,Avatar,Action,2023-04-01,6.0,162,TV,4,Monday,0,0.037,0,0,1,0,Long,TV\n014,Titanic,Romance,2023-02-14,7.0,195,Smartphone,2,Tuesday,0,0.036,0,0,0,1,Long,Mobile"}
{"purpose": "Engineer features from student performance and attendance data to predict final exam success.", "raw_table": "Student_ID,Name,Enrollment_Date,Gender,Math_Score,English_Score,Science_Score,Attendance_Percentage,Extra_Curricular\nS001,alice,january 15,2023,F,85,78,NA,92%,Drama Club\nS002,BOB,2023/02/10,M,90,NA,88,85%,soccer\nS003,charlie,03-05-2023,M,NA,72,65,88%,Drama club\nS004,Diana,2023.04.01,F,70,75,80,,Chess\nS005,edward,April 20 2023,M,55,60,58,80%,Chess\nS006,Fiona,2023-05-15,f,88,90,95,95%,SOCCER\nS007,George,06/10/2023,M,65,70,,78%,debate\nS008,Hannah,15 Jul 2023,F,92,88,91,99%,Debate\nS009,Ian,2023-08-01,M,75,sixty,70,82%,Music\nS010,julia,08-15-2023,F,80,85,88,90%,music\n", "fe_steps": ["Standardize Enrollment_Date to ISO format YYYY-MM-DD", "Fill missing numeric scores with the mean score of that subject", "Convert Attendance_Percentage to numeric by removing percentage sign", "Normalize Gender column to lowercase", "Map Extra_Curricular activities to standardized lowercase categories", "Create an Average_Score feature by averaging Math_Score, English_Score, and Science_Score", "Create a High_Attendance boolean feature where Attendance_Percentage >= 90", "One-hot encode the Gender column", "One-hot encode the Extra_Curricular column", "Extract Enrollment_Month from Enrollment_Date"], "fe_table": "Student_ID,Name,Enrollment_Date,Gender,Math_Score,English_Score,Science_Score,Attendance_Percentage,Extra_Curricular,Average_Score,High_Attendance,Gender_f,Gender_m,Extra_Curricular_chess,Extra_Curricular_debate,Extra_Curricular_drama club,Extra_Curricular_music,Extra_Curricular_soccer,Enrollment_Month\nS001,alice,2023-01-15,f,85.0,78.0,74.0,92.0,drama club,79.0,True,1,0,0,0,1,0,0,1\nS002,BOB,2023-02-10,m,90.0,77.3,88.0,85.0,soccer,85.1,False,0,1,0,0,0,0,1,2\nS003,charlie,2023-03-05,m,75.9,72.0,65.0,88.0,drama club,70.9,False,0,1,0,0,1,0,0,3\nS004,Diana,2023-04-01,f,70.0,75.0,80.0,83.8,chess,75.0,False,1,0,1,0,0,0,0,4\nS005,edward,2023-04-20,m,55.0,60.0,58.0,80.0,chess,57.7,False,0,1,1,0,0,0,0,4\nS006,Fiona,2023-05-15,f,88.0,90.0,95.0,95.0,soccer,91.0,True,1,0,0,0,0,0,1,5\nS007,George,2023-06-10,m,65.0,70.0,74.9,78.0,debate,69.9,False,0,1,0,1,0,0,0,6\nS008,Hannah,2023-07-15,f,92.0,88.0,91.0,99.0,debate,90.3,True,1,0,0,1,0,0,0,7\nS009,Ian,2023-08-01,m,75.0,77.3,70.0,82.0,music,74.1,False,0,1,0,0,0,1,0,8\nS010,julia,2023-08-15,f,80.0,85.0,88.0,90.0,music,84.3,True,1,0,0,0,0,1,0,8\n"}
{"purpose": "Engineer features from student enrollment and performance data to predict course completion success.", "raw_table": "StudentID,EnrollmentDate,Course,Attendance,AssignmentScore,FinalGrade,Participation\nS001,2023-01-15,math,85%,78,Pass,high\ns002,15/02/2023,Math,90 percent,82,pass,medium\nS003,2023/03/10,english,,70,fail,Low\nS004,2023-04-05,ENGLISH,88,missing,Fail,low\ns005,05-05-2023,Science,80%,85,Pass,High\nS006,2023-06-12,science,82,88,Pass,MEDium\nS007,2023-07-01,mAtH,missing,75,Fail,none\nS008,07/15/2023,English,78,missing,fail,Medium\nS009,2023-08-20,SCIENCE,85%,90,Pass,High\nS010,2023-09-09,Math,87,83,Pass,medium", "fe_steps": ["Normalize Course names to lowercase", "Convert EnrollmentDate to ISO format yyyy-mm-dd", "Extract EnrollmentMonth from EnrollmentDate", "Convert Attendance percentages and strings to numeric values; impute missing Attendance with mean attendance", "Impute missing AssignmentScore with median AssignmentScore", "Map FinalGrade to binary numeric (Pass=1, Fail=0)", "Map Participation levels to ordinal scale (none=0, low=1, medium=2, high=3)", "Create a new feature AverageScore as mean of Attendance and AssignmentScore", "Create a boolean feature HighAttendance indicating Attendance >= 85", "One-hot encode Course"], "fe_table": "StudentID,EnrollmentDate,Course,Attendance,AssignmentScore,FinalGrade,Participation,EnrollmentMonth,AttendanceNumeric,AssignmentScoreImputed,FinalGradeBinary,ParticipationOrdinal,AverageScore,HighAttendance,Course_math,Course_english,Course_science\nS001,2023-01-15,math,85%,78,Pass,high,01,85,78,1,3,81.5,1,1,0,0\ns002,2023-02-15,math,90 percent,82,pass,medium,02,90,82,1,2,86,1,1,0,0\nS003,2023-03-10,english,,70,fail,Low,03,83.22,70,0,1,76.61,0,0,1,0\nS004,2023-04-05,english,88,missing,Fail,low,04,88,82,0,1,85,1,0,1,0\ns005,2023-05-05,science,80%,85,Pass,High,05,80,85,1,3,82.5,0,0,0,1\nS006,2023-06-12,science,82,88,Pass,MEDium,06,82,88,1,2,85,0,0,0,1\nS007,2023-07-01,math,missing,75,Fail,none,07,83.22,75,0,0,79.11,0,1,0,0\nS008,2023-07-15,english,78,missing,fail,Medium,07,78,82,0,2,80,0,0,1,0\nS009,2023-08-20,science,85%,90,Pass,High,08,85,90,1,3,87.5,1,0,0,1\nS010,2023-09-09,math,87,83,Pass,medium,09,87,83,1,2,85,1,1,0,0"}
{"purpose": "Engineer clean and informative features from student academic records to predict course completion success.", "raw_table": "Student_ID,Name,Enrollment_Date,Course,Grade,Attendance_Percentage,Last_Activity,Comments\nS001,alice SMITH,2023-01-15,Data Science,85,90%,2023/05/10,Good progress\nS002,Bob jOnes,15-02-2023,Data science,seventy-eight,85%,May 12 2023,Needs improvement\nS003,Charlie,2023/03/01,Machine Learning,92,missing,2023-05-09,Excellent\nS004,diana Evans,2023-01-30,Machine learning,88,88%,2023-05-11,On track\nS005,Edward,2023/02/20,Data Science,81,80%,2023/5/8,absent last week\nS006,frank MOORE,2023-02-25,Data science,89,92%,May 10 2023,\nS007,Grace harrison,2023-01-10,Machine Learning,NA,75%,2023-05-07,Needs help\nS008,henry,2023-03-15,Data Science,85,87%,2023-05-12,Good\nS009,Isabel,2023/01/05,Machine learning,90,missing,2023/05/10,Excellent work\nS010,jack,2023-02-28,Data Science,83,83%,2023-05-09,average\nS011,Kate,2023-01-20,Machine Learning,95,95%,2023-05-12,Excellent\nS012,Luke,2023-03-05,Data science,not available,78%,2023-05-10,missing grade\n", "fe_steps": ["Standardize Name column to title case", "Parse Enrollment_Date and Last_Activity into ISO date format (YYYY-MM-DD)", "Impute missing Attendance_Percentage with median attendance", "Convert Grade to numeric, mapping textual grades or invalid strings to missing", "Impute missing Grade values with average grade per Course", "Normalize Course names to consistent capitalization", "Calculate Days_Enrolled as difference between Last_Activity and Enrollment_Date", "Create Attendance_Flag indicating if attendance is above 85%", "Extract Enrollment_Month from Enrollment_Date", "Encode Comments sentiment as Positive, Neutral, or Negative based on keywords"], "fe_table": "Student_ID,Name,Enrollment_Date,Course,Grade,Attendance_Percentage,Last_Activity,Comments,Days_Enrolled,Attendance_Flag,Enrollment_Month,Comments_Sentiment\nS001,Alice Smith,2023-01-15,Data Science,85,90,2023-05-10,Good progress,115,1,1,Positive\nS002,Bob Jones,2023-02-15,Data Science,78,85,2023-05-12,Needs improvement,86,0,2,Negative\nS003,Charlie,2023-03-01,Machine Learning,92,83,2023-05-09,Excellent,69,0,3,Positive\nS004,Diana Evans,2023-01-30,Machine Learning,88,88,2023-05-11,On track,101,1,1,Neutral\nS005,Edward,2023-02-20,Data Science,81,80,2023-05-08,absent last week,77,0,2,Negative\nS006,Frank Moore,2023-02-25,Data Science,89,92,2023-05-10,,74,1,2,Neutral\nS007,Grace Harrison,2023-01-10,Machine Learning,88,75,2023-05-07,Needs help,117,0,1,Negative\nS008,Henry,2023-03-15,Data Science,85,87,2023-05-12,Good,58,1,3,Positive\nS009,Isabel,2023-01-05,Machine Learning,90,83,2023-05-10,Excellent work,125,0,1,Positive\nS010,Jack,2023-02-28,Data Science,83,83,2023-05-09,average,70,0,2,Neutral\nS011,Kate,2023-01-20,Machine Learning,95,95,2023-05-12,Excellent,112,1,1,Positive\nS012,Luke,2023-03-05,Data Science,83,78,2023-05-10,missing grade,66,0,3,Neutral"}
{"purpose": "Engineer features from raw climate sensor readings and weather observations for predicting local air quality index.", "raw_table": "Station_ID,Date,Temperature_C,Humidity_Percent,Wind_Speed_kmh,Weather,Air_Quality\nS001,2024/04/01,15.2,55,12,Clear,Good\ns002,01-04-2024,NaN,65,8.5,cloudy,fair\nS003,2024-04-02,17.8,missing,10,Partly Cloudy,Moderate\nS001,4/3/2024,16,58,NA,Clear,good\nS002,2024-04-03,14.5,62,11,clear,FAIR\ns003,2024/04/03,18.3,60,9,partly cloudy,moderate\nS001,2024-04-04,16.7,57,13,Clear,Good\nS002,04-04-2024,15.1,66,7.5,cloudy, Fair\nS003,2024-04-04,17.9,59,NaN,Partly Cloudy,MODERATE\nS001,2024/04/05,NaN,56,15,Clear,Good\ns002,2024-04-05,14.8,63,8,CLOUDY,fair\nS003,2024/04/05,18.1,,10,partly cloudy,Moderate\n", "fe_steps": ["Normalize Station_ID to uppercase", "Parse Date column into a uniform date format and extract day_of_week", "Impute missing Temperature_C values with the station's average temperature", "Fill missing Humidity_Percent values with the overall median humidity", "Convert Wind_Speed_kmh to numeric and fill missing values with median wind speed", "Standardize Weather categories with consistent capitalization and consolidate variants", "Map Air_Quality labels to numeric scale: Good=1, Fair=2, Moderate=3", "Create a boolean feature 'Is_Clear' indicating if Weather is Clear", "Calculate Temperature-Humidity interaction as Temperature_C * Humidity_Percent"], "fe_table": "Station_ID,Date,Temperature_C,Humidity_Percent,Wind_Speed_kmh,Weather,Air_Quality,day_of_week,Temperature_C_Imputed,Humidity_Percent_Imputed,Wind_Speed_kmh_Imputed,Weather_Standardized,Air_Quality_Score,Is_Clear,Temp_Humidity_Interaction\nS001,2024-04-01,15.2,55.0,12.0,Clear,Good,Monday,15.2,55.0,12.0,Clear,1,true,836.0\nS002,2024-04-01,15.6,65.0,8.5,Cloudy,Fair,Monday,15.6,65.0,8.5,Cloudy,2,false,1014.0\nS003,2024-04-02,17.8,60.5,10.0,Partly Cloudy,Moderate,Tuesday,17.8,60.5,10.0,Partly Cloudy,3,false,1077.9\nS001,2024-04-03,16.0,58.0,11.0,Clear,Good,Wednesday,16.0,58.0,11.0,Clear,1,true,928.0\nS002,2024-04-03,14.5,62.0,11.0,Clear,Fair,Wednesday,14.5,62.0,11.0,Clear,2,false,899.0\nS003,2024-04-03,18.3,60.0,9.0,Partly Cloudy,Moderate,Wednesday,18.3,60.0,9.0,Partly Cloudy,3,false,1098.0\nS001,2024-04-04,16.7,57.0,13.0,Clear,Good,Thursday,16.7,57.0,13.0,Clear,1,true,951.9\nS002,2024-04-04,15.1,66.0,7.5,Cloudy,Fair,Thursday,15.1,66.0,7.5,Cloudy,2,false,996.6\nS003,2024-04-04,17.9,59.0,9.0,Partly Cloudy,Moderate,Thursday,17.9,59.0,9.0,Partly Cloudy,3,false,1056.1\nS001,2024-04-05,15.975,56.0,15.0,Clear,Good,Friday,15.975,56.0,15.0,Clear,1,true,894.0\nS002,2024-04-05,14.8,63.0,8.0,Cloudy,Fair,Friday,14.8,63.0,8.0,Cloudy,2,false,932.4\nS003,2024-04-05,18.1,60.5,10.0,Partly Cloudy,Moderate,Friday,18.1,60.5,10.0,Partly Cloudy,3,false,1096.0\n"}
{"purpose": "Engineer features from raw movie viewing logs to predict user retention and engagement.", "raw_table": "UserID,MovieTitle,Genre,WatchDate,DurationMinutes,Rating,Device\nu001,The Matrix,Sci-Fi,2023-04-15,136,5,Smartphone\nU002,inception,Action,15/04/2023,148,4.5,Smart TV\nu003,The godfather,crime,2023/04/14,175 mins,NA,Laptop\nu004,Avengers,endgame,Action,04-13-2023,182,5,Tablet\nU005,Toy Story,animation,2023-04-16,,4.8,smartphone\nu006,INCEPTION,Action,2023.04.16,148,4.0,Smartphone\nu007,The matrix,Sci-fi,2023-04-15,136 mins,3.5,Smart TV\nu008,Toy story,Animation,16-Apr-2023,81,4.9,Tablet\nu009,The Godfather,Crime,2023-04-15,175,5,Laptop\nU010,Avengers Endgame,Action,2023-04-14,182,NA,Smart TV", "fe_steps": ["Standardize Genre and MovieTitle to title case", "Parse WatchDate into a uniform YYYY-MM-DD date format", "Extract day_of_week and month from WatchDate", "Convert DurationMinutes to integer minutes, removing 'mins' and filling missing with median", "Impute missing Rating values with the average rating per MovieTitle", "Map Device types to standardized categories: Smartphone, Smart TV, Laptop, Tablet", "Create a binary feature 'HighRating' for ratings >= 4.5", "Calculate average WatchDuration per UserID as 'AvgUserDuration'", "One-hot encode Genre"], "fe_table": "UserID,MovieTitle,Genre,WatchDate,DurationMinutes,Rating,Device,DayOfWeek,Month,DurationMinutesCleaned,RatingImputed,DeviceStandard,HighRating,AvgUserDuration,Genre_Action,Genre_Animation,Genre_Crime,Genre_Sci-Fi\nu001,The Matrix,Sci-Fi,2023-04-15,136,5,Smartphone,Saturday,04,136,5,Smartphone,1,137.33,0,0,0,1\nU002,Inception,Action,2023-04-15,148,4.5,Smart TV,Saturday,04,148,4.5,Smart TV,1,148.0,1,0,0,0\nu003,The Godfather,Crime,2023-04-14,175,4.7,Laptop,Friday,04,175,4.7,Laptop,1,175.0,0,0,1,0\nu004,Avengers Endgame,Action,2023-04-13,182,5,Tablet,Thursday,04,182,5,Tablet,1,182.0,1,0,0,0\nU005,Toy Story,Animation,2023-04-16,81,4.8,Smartphone,Sunday,04,81,4.8,Smartphone,1,81.0,0,1,0,0\nu006,Inception,Action,2023-04-16,148,4.0,Smartphone,Sunday,04,148,4.0,Smartphone,0,148.0,1,0,0,0\nu007,The Matrix,Sci-Fi,2023-04-15,136,3.5,Smart TV,Saturday,04,136,3.5,Smart TV,0,136.0,0,0,0,1\nu008,Toy Story,Animation,2023-04-16,81,4.9,Tablet,Sunday,04,81,4.9,Tablet,1,81.0,0,1,0,0\nu009,The Godfather,Crime,2023-04-15,175,5,Laptop,Saturday,04,175,5,Laptop,1,175.0,0,0,1,0\nU010,Avengers Endgame,Action,2023-04-14,182,4.45,Smart TV,Friday,04,182,4.45,Smart TV,0,182.0,1,0,0,0"}
{"purpose": "Engineer features from student enrollment and performance data to predict course completion likelihood.", "raw_table": "Student_ID,Enrollment_Date,Course,Grade,Attendance_Percentage,Study_Hours,Status\nS001,2023-01-15,math,85,92.5,15,completed\ns002,01/20/2023,Math,78,88,12.5,Completed\nS003,2023/02/10,science,missing,75%,ten,active\nS004,2-15-2023,SCIENCE,65,,8,Active\ns005,2023-03-01,English,90,95%,20,Completed\nS006,03/05/2023,english,not available,85,15,Active\nS007,2023-04-01,History,70,80%,12,completed\ns008,2023.04.10,HISTORY,72,82,eleven,active\nS009,2023-05-01,Math,88,90%,18,Completed\ns010,2023/05/15,Science,missing,78%,14,Active", "fe_steps": ["Standardize Enrollment_Date to YYYY-MM-DD format", "Fill missing Grade values with the median grade", "Convert Attendance_Percentage to numeric values removing percentage signs", "Convert Study_Hours to numeric, replacing non-numeric entries with the median study hours", "Normalize Course names to lowercase", "Encode Status as binary: completed=1, active=0", "Create a new feature Days_Since_Enrollment from Enrollment_Date assuming current date is 2023-06-01", "Bucketize Grade into categories: low (<70), medium (70-85), high (>85)", "One-hot encode Course categories", "Standardize numeric columns: Grade, Attendance_Percentage, Study_Hours, Days_Since_Enrollment"], "fe_table": "Student_ID,Enrollment_Date,Course,Grade,Attendance_Percentage,Study_Hours,Status,Days_Since_Enrollment,Grade_Category,Status_Binary,course_english,course_history,course_math,course_science,Grade_std,Attendance_Percentage_std,Study_Hours_std,Days_Since_Enrollment_std\nS001,2023-01-15,math,85,92.5,15,completed,137,medium,1,0,0,1,0,0.09,1.27,0.09,0.54\ns002,2023-01-20,math,78,88,12.5,Completed,132,medium,1,0,0,1,0,-0.69,0.42,-0.37,0.38\nS003,2023-02-10,science,78,75,13,active,111,medium,0,0,0,0,1,-0.69,-1.13,-0.19,0.04\nS004,2023-02-15,science,65,81,8,Active,106,low,0,0,0,0,1,-1.84,-0.24,-1.52,-0.13\ns005,2023-03-01,english,90,95,20,Completed,90,high,1,1,0,0,0,0.56,1.62,1.18,-0.29\nS006,2023-03-05,english,78,85,15,Active,86,medium,0,1,0,0,0,-0.69,-0.04,0.09,-0.36\nS007,2023-04-01,history,70,80,12,completed,61,medium,1,0,1,0,0,-1.25,-0.41,-0.37,-0.69\ns008,2023-04-10,history,72,82,13,active,52,medium,0,0,1,0,0,-1.09,-0.31,-0.19,-0.82\nS009,2023-05-01,math,88,90,18,Completed,32,high,1,0,0,1,0,0.78,0.07,0.82,-1.02\ns010,2023-05-15,science,78,78,14,Active,18,medium,0,0,0,0,1,-0.69,-0.72,0.28,-1.11"}
{"purpose": "Engineer features from raw call records to improve churn prediction models in telecommunications.", "raw_table": "CustomerID,CallDate,CallDuration,CallType,DataUsage,PlanType,PaymentStatus\n12345,2023-01-15,300,Local,1.5GB,PREMIUM,Paid\n12346,15/01/2023,45,International,0.2GB,standard,paid\n12347,2023/01/16,NA,local,0GB,Basic,Unpaid\n12348,01-17-2023,120,Local,500MB,Standard,PAID\n12349,2023-01-18,abc,International,,premium,paid\n12350,18 Jan 2023,75,local,1GB,basic,Pending\n12351,2023-01-19,200,INTERNATIONAL,2.5GB,Standard,paid\n12352,2023-01-20,90,Local,750mb,Premium,Paid\n12353,20-01-2023,60,local,0.0GB,BASIC,paid\n12354,2023-01-21,150,International,1.8GB,premium,PAID", "fe_steps": ["Standardize CallDate to ISO yyyy-mm-dd format", "Convert CallDuration to numeric, replace invalid or missing with median call duration", "Normalize CallType values to lowercase and unify categories as 'local' or 'international'", "Convert DataUsage to numeric float in GB (handle MB to GB conversion and zeros)", "Standardize PlanType capitalization to title case", "Map PaymentStatus to binary numeric where Paid=1, Unpaid or Pending=0", "Extract day_of_week from CallDate", "Create call_duration_bucket with categories: short(<60s), medium(60-180s), long(>180s)", "Create is_premium_plan binary feature from PlanType", "Log transform DataUsage to reduce skewness", "One-hot encode CallType"], "fe_table": "CustomerID,CallDate,CallDuration,CallType,DataUsage,PlanType,PaymentStatus,DayOfWeek,CallDurationBucket,IsPremiumPlan,DataUsageLog,CallType_local,CallType_international,PaymentStatusBinary\n12345,2023-01-15,300,local,1.5,Premium,1,Sunday,long,1,0.405465,1,0,1\n12346,2023-01-15,45,international,0.2,Standard,1,Sunday,short,0,-1.609438,0,1,1\n12347,2023-01-16,90,local,0.0,Basic,0,Monday,medium,0,-7.824046,1,0,0\n12348,2023-01-17,120,local,0.5,Standard,1,Tuesday,medium,0,-0.693147,1,0,1\n12349,2023-01-18,105,international,0.0,Premium,1,Wednesday,medium,1,-7.824046,0,1,1\n12350,2023-01-18,75,local,1.0,Basic,0,Wednesday,medium,0,0.0,1,0,0\n12351,2023-01-19,200,international,2.5,Standard,1,Thursday,long,0,0.916291,0,1,1\n12352,2023-01-20,90,local,0.75,Premium,1,Friday,medium,1,-0.287682,1,0,1\n12353,2023-01-20,60,local,0.0,Basic,1,Friday,medium,0,-7.824046,1,0,1\n12354,2023-01-21,150,international,1.8,Premium,1,Saturday,medium,1,0.587787,0,1,1"}
{"purpose": "Engineer features from sales transaction data to improve demand forecasting models.", "raw_table": "TransactionID,Date,CustomerID,ProductCategory,Quantity,Price,PaymentMethod\nT001,2023-01-05, cust_01, electronics, 2, 199.99, CreditCard\nT002,01/07/2023,cust_02,Electronics ,1, two hundred, paypal\nT003,2023/01/08,,home & Garden,3, 45.50, credit card\nT004, 1-10-2023,CUST_03,Home & garden,NaN,40.00,CASH\nT005,2023-01-11,cust_04,Fashion,1,79.9,PayPal\nT006,13-01-2023,cust_05,fashion,1,twenty one,cash\nT007,2023-01-14,CUST_06,Electronics,2,210.00,Credit Card\nT008,2023/01/15,cust_07,home & garden,1, 50.00,paypal\nT009,16/01/2023,cust_08,Fashion,NaN,89.00,Cash\nT010,2023-01-17,cust_09,electronics,1,199.99,creditcard", "fe_steps": ["Standardize the Date column to YYYY-MM-DD format", "Fill missing Quantity values with the median Quantity", "Convert Price values from string to numeric, replacing non-numeric entries with the median Price", "Normalize ProductCategory values to lowercase and remove extra spaces", "One-hot encode ProductCategory", "Extract day_of_week from Date", "Create a total_amount feature by multiplying Quantity and Price", "Map PaymentMethod to standardized categories: creditcard, paypal, cash", "One-hot encode PaymentMethod", "Fill missing CustomerID with 'unknown'"], "fe_table": "TransactionID,Date,CustomerID,ProductCategory,Quantity,Price,PaymentMethod,day_of_week,total_amount,productcategory_electronics,productcategory_fashion,productcategory_home & garden,paymentmethod_creditcard,paymentmethod_paypal,paymentmethod_cash\nT001,2023-01-05,cust_01,electronics,2,199.99,creditcard,Thursday,399.98,1,0,0,1,0,0\nT002,2023-01-07,cust_02,electronics,1,199.99,paypal,Saturday,199.99,1,0,0,0,1,0\nT003,2023-01-08,unknown,home & garden,3,45.50,creditcard,Sunday,136.5,0,0,1,1,0,0\nT004,2023-01-10,cust_03,home & garden,2,40.00,cash,Tuesday,80.0,0,0,1,0,0,1\nT005,2023-01-11,cust_04,fashion,1,79.90,paypal,Wednesday,79.9,0,1,0,0,1,0\nT006,2023-01-13,cust_05,fashion,1,21.00,cash,Friday,21.0,0,1,0,0,0,1\nT007,2023-01-14,cust_06,electronics,2,210.00,creditcard,Saturday,420.0,1,0,0,1,0,0\nT008,2023-01-15,cust_07,home & garden,1,50.00,paypal,Sunday,50.0,0,0,1,0,1,0\nT009,2023-01-16,cust_08,fashion,2,89.00,cash,Monday,178.0,0,1,0,0,0,1\nT010,2023-01-17,cust_09,electronics,1,199.99,creditcard,Tuesday,199.99,1,0,0,1,0,0"}
{"purpose": "Engineer features to predict machine failure within the manufacturing process based on sensor readings and operational logs.", "raw_table": "Machine_ID,Operation_Date,Shift,Temperature,Pressure,Operator_Status,Error_Code\nM001,2023-03-15,Morning,75.2,101.3,Active,0\nm002,15/03/2023,NIGHT,77.0,OneZeroTwo,Inactive,E12\nM003,03-16-2023,Morning,NaN,99.8,active,E07\nM004,2023/03/17,evening,74.5,100.7,Active,e07\nM005,Mar 18 2023,MORNING,73.9,99.9,Inactive,0\nM006,2023-03-19,Night,78.1,101.1,active,E12\nM007,2023-03-20,morning,76.3,NaN,Active,0\nM008,03/21/2023,Evening,75.8,100.5,Inactive,e07\nm009,2023.03.22,NIGHT,missing,102.0,active,0\nM010,2023-03-23,Morning,74.1,101.0,Inactive,E12", "fe_steps": ["Normalize Operation_Date column to ISO format (YYYY-MM-DD)", "Standardize Shift values to title case (Morning, Night, Evening)", "Convert Temperature and Pressure columns to numeric, replacing non-numeric or missing with column median", "Map Operator_Status to binary numeric (Active=1, Inactive=0)", "Extract day_of_week from Operation_Date", "Create error_flag column, setting 1 if Error_Code is not '0', else 0", "One-hot encode Shift column", "Apply min-max scaling to Temperature and Pressure columns", "Compute temp_pressure_ratio as Temperature divided by Pressure"], "fe_table": "Machine_ID,Operation_Date,Shift,Temperature,Pressure,Operator_Status,Error_Code,day_of_week,error_flag,Shift_Morning,Shift_Night,Shift_Evening,Operator_Status_Binary,Temperature_Scaled,Pressure_Scaled,temp_pressure_ratio\nM001,2023-03-15,Morning,75.2,101.3,Active,0,Wednesday,0,1,0,0,1,0.4483,0.6333,0.742\nM002,2023-03-15,Night,77.0,101.3,Inactive,E12,Wednesday,1,0,1,0,0,0.5172,0.6333,0.761\nM003,2023-03-16,Morning,75.95,99.8,Active,E07,Thursday,1,1,0,0,1,0.4828,0.5000,0.761\nM004,2023-03-17,Evening,74.5,100.7,Active,E07,Friday,1,0,0,1,1,0.4138,0.5667,0.740\nM005,2023-03-18,Morning,73.9,99.9,Inactive,0,Saturday,0,1,0,0,0,0.3793,0.5167,0.739\nM006,2023-03-19,Night,78.1,101.1,Active,E12,Sunday,1,0,1,0,1,0.5517,0.6167,0.773\nM007,2023-03-20,Morning,76.3,100.3,Active,0,Monday,0,1,0,0,1,0.4828,0.5500,0.761\nM008,2023-03-21,Evening,75.8,100.5,Inactive,E07,Tuesday,1,0,0,1,0,0.4655,0.5667,0.754\nM009,2023-03-22,Night,75.8,102.0,Active,0,Wednesday,0,0,1,0,1,0.4655,0.6667,0.743\nM010,2023-03-23,Morning,74.1,101.0,Inactive,E12,Thursday,1,1,0,0,0,0.3793,0.6167,0.734"}
{"purpose": "Engineer features to predict user engagement levels on social media posts.", "raw_table": "PostID,UserID,PostDate,PostType,ContentLength,NumLikes,NumComments,Hashtags\n1,u123,2023-03-01,text,120,45,10,#fun #sun\n2,U124,03/02/2023,Image,NA,30,5,#travel\n3,u125,2023/03/03,video,300,ERROR,20,#Fun\n4,u126,03-04-2023,Text,150,55,,#Sun #beach\n5,U127,2023-03-05,image,200,40,12,#travel #Adventure\n6,u128,2023/03/06,video,310,60,25,#fun\n7,u129,03-07-2023,text,N/A,35,8,#beach\n8,U130,2023-3-08,text,180,50,15,#Travel\n9,u131,03/09/2023,Image,190,45,10,#fun #sun\n10,U132,2023-03-10,Video,320,70,30,#Adventure\n11,u133,2023-03-11,text,160,,7,#sun\n12,u134,2023-03-12,video,NaN,65,20,#Fun\n13,U135,03-13-2023,image,210,55,18,#travel\n14,u136,2023/03/14,text,140,40,5,#beach\n15,U137,2023-03-15,video,305,60,22,#Fun #Sun", "fe_steps": ["Standardize and parse PostDate into YYYY-MM-DD format", "Fill missing numeric values in NumLikes and NumComments with the median of their respective columns", "Correct and standardize PostType values to lowercase", "Extract day_of_week from PostDate", "Calculate EngagementScore as NumLikes plus twice NumComments", "Count number of hashtags in Hashtags column", "Create a binary feature HasHashtags indicating presence of any hashtag", "Apply log transform to ContentLength to reduce skewness", "One-hot encode PostType", "Standardize numeric columns ContentLength (log transformed), NumLikes, NumComments, EngagementScore, HashtagCount"], "fe_table": "PostID,UserID,PostDate,PostType,ContentLength,NumLikes,NumComments,Hashtags,PostDate_standard,PostType_std,DayOfWeek,EngagementScore,HashtagCount,HasHashtags,ContentLength_log,NumLikes_std,NumComments_std,EngagementScore_std,HashtagCount_std,PostType_text,PostType_image,PostType_video\n1,u123,2023-03-01,text,120,45,10,#fun #sun,2023-03-01,text,3,65,2,1,4.787492, -0.09, -0.01, -0.07, 0.01,1,0,0\n2,U124,2023-03-02,image,150,30,5,#travel,2023-03-02,image,4,40,1,1,5.010635, -1.47, -1.17, -1.38, -1.16,0,1,0\n3,u125,2023-03-03,video,300,50,20,#Fun,2023-03-03,video,5,90,1,1,5.703782, -0.19, 0.8, 0.26, 0.01,0,0,1\n4,u126,2023-03-04,text,150,55,9,#Sun #beach,2023-03-04,text,6,73,2,1,5.010635,0.28, -0.09, 0.04, 0.01,1,0,0\n5,U127,2023-03-05,image,200,40,12,#travel #Adventure,2023-03-05,image,7,64,2,1,5.298317, -0.52, 0.43, -0.12, 0.01,0,1,0\n6,u128,2023-03-06,video,310,60,25,#fun,2023-03-06,video,1,110,1,1,5.736572,0.66, 1.62, 1.06, 0.01,0,0,1\n7,u129,2023-03-07,text,150,35,8,#beach,2023-03-07,text,2,51,1,1,5.010635, -1.03, -0.31, -0.73, 0.01,1,0,0\n8,U130,2023-03-08,text,180,50,15,#Travel,2023-03-08,text,3,80,1,1,5.192957, -0.19, 0.33, 0.08, 0.01,1,0,0\n9,u131,2023-03-09,image,190,45,10,#fun #sun,2023-03-09,image,4,65,2,1,5.247024, -0.09, -0.01, -0.07, 0.01,0,1,0\n10,U132,2023-03-10,video,320,70,30,#Adventure,2023-03-10,video,5,130,1,1,5.768321,1.34, 2.44, 1.98, 0.01,0,0,1\n11,u133,2023-03-11,text,160,45,7,#sun,2023-03-11,text,6,59,1,1,5.075174, -0.09, -0.53, -0.27, 0.01,1,0,0\n12,u134,2023-03-12,video,200,65,20,#Fun,2023-03-12,video,7,105,1,1,5.298317,0.66, 0.8, 1.01, 0.01,0,0,1\n13,U135,2023-03-13,image,210,55,18,#travel,2023-03-13,image,1,91,1,1,5.347107,0.28, 1.18, 0.5, 0.01,0,1,0\n14,u136,2023-03-14,text,140,40,5,#beach,2023-03-14,text,2,50,1,1,4.941642, -0.52, -1.17, -1.43, 0.01,1,0,0\n15,U137,2023-03-15,video,305,60,22,#Fun #Sun,2023-03-15,video,3,104,2,1,5.720312,0.66, 1.03, 1.01, 0.01,0,0,1"}
{"purpose": "Engineer features from patient visit records to improve models predicting hospital readmission risk.", "raw_table": "PatientID,VisitDate,Age,Gender,Diagnosis,Severity,Weight_kg,Height_cm,Smoker,FollowUp\nP001,2023/01/15,45,M,Diabetes,Moderate,70,175,Y,Yes\nP002,15-02-2023,58,F,Hypertension,Severe,82kg,160,N,No\nP003,2023-03-10,NA,M,diabetes,Mild,65,NA,yes,Yes\nP004,03/25/2023,39,f,Asthma,moderate,invalid,170,N,Y\nP005,2023.04.01,50,M,Hypertension,SeverE,90,180,No,No\nP006,2023-04-15,65,F,asthma,,85,160,Y,\nP007,2023/05/10,72,,Diabetes,Moderate,78,172,N,Yes\nP008,2023-05-20,55,F,Hypertension,Mild,88,NaN,Y,No\nP009,05-25-2023,60,M,Asthma,Severe,75,168,No,Yes\nP010,2023-06-01,47,f,Diabetes,Mild,68,165,y,No", "fe_steps": ["Standardize 'VisitDate' to YYYY-MM-DD format and extract 'visit_month' as a new feature", "Fill missing 'Age' values with the median age", "Normalize 'Gender' entries to uppercase single letters 'M' or 'F' and fill missing as 'U' for unknown", "Remove non-numeric characters from 'Weight_kg' and convert to numeric", "Impute missing or invalid 'Weight_kg' and 'Height_cm' with median values", "Create BMI feature by calculating weight in kg divided by squared height in meters", "Map 'Severity' labels to numeric scale: Mild=1, Moderate=2, Severe=3, missing=0", "Standardize 'Smoker' to binary (1 for yes, 0 for no) ignoring case and missing as 0", "Convert 'FollowUp' to binary (1 for Yes, 0 for No) and fill missing with 0"], "fe_table": "PatientID,VisitDate,Age,Gender,Diagnosis,Severity,Weight_kg,Height_cm,Smoker,FollowUp,visit_month,BMI,Severity_Num,Smoker_Binary,FollowUp_Binary\nP001,2023-01-15,45,M,Diabetes,Moderate,70,175,1,1,01,22.86,2,1,1\nP002,2023-02-15,58,F,Hypertension,Severe,82,160,0,0,02,32.03,3,0,0\nP003,2023-03-10,55,M,diabetes,Mild,65,172,1,1,03,21.96,1,1,1\nP004,2023-03-25,39,F,Asthma,moderate,77,170,0,1,03,26.64,2,0,1\nP005,2023-04-01,50,M,Hypertension,SeverE,90,180,0,0,04,27.78,3,0,0\nP006,2023-04-15,65,F,asthma,0,85,160,1,0,04,33.20,0,1,0\nP007,2023-05-10,72,U,Diabetes,Moderate,78,172,0,1,05,26.38,2,0,1\nP008,2023-05-20,55,F,Hypertension,Mild,88,172,1,0,05,29.74,1,1,0\nP009,2023-05-25,60,M,Asthma,Severe,75,168,0,1,05,26.57,3,0,1\nP010,2023-06-01,47,F,Diabetes,Mild,68,165,1,0,06,24.98,1,1,0"}
{"purpose": "Engineer comprehensive features from patient visit data to enhance prediction of hospital readmission risk.", "raw_table": "PatientID,VisitDate,Age,Gender,Diagnosis,Weight,Height,BloodPressure,Smoker\n001,2023/01/15,45,Male,Hypertension,78kg,175 cm,120/80,Yes\n002,15-02-2023,60,female,Diabetes type 2,85 kg,168cm,130/85,no\n003,2023-03-10,NaN,Male,hypertension,NaN,180,125/82,Yes\n004,04/25/2023,35,FEMALE,Obesity,95 kg,NaN,140/90,\n005,2023.05.05,50,Male,Diabetes Type 2,88kg,172 cm,135/90,y\n006,06-15-2023,29,Female,hypertension,70kg,165cm,115/75,No\n007,2023/07/20,55,Male,Obesity,NaN,178 cm,145/95,Yes\n008,08/10/2023,42,Female,Diabetes,82kg,170cm,128/85,No\n009,2023-09-01,39,Male,Hypertension,80kg,179 cm,NaN,yes\n010,10/12/2023,65,Female,Diabetes Type 2,90kg,168,138/88,No", "fe_steps": ["Standardize VisitDate to YYYY-MM-DD format", "Fill missing Age values with median age", "Normalize Gender values to lowercase", "Standardize Diagnosis categories to 'Hypertension', 'Diabetes', or 'Obesity'", "Extract systolic and diastolic values from BloodPressure", "Convert Weight and Height to numeric values in kilograms and centimeters respectively", "Calculate BMI from Weight and Height", "Map Smoker to binary indicator (1 for yes, 0 for no)", "Bucketize Age into ranges: 'Young' (<40), 'Middle-aged' (40-59), 'Senior' (60+)", "One-hot encode Diagnosis and Age bucket categories"], "fe_table": "PatientID,VisitDate,Age,Gender,Diagnosis,Weight,Height,BloodPressure,Smoker,VisitDate_standard,Age_filled,Gender_norm,Diagnosis_std,Systolic,Diastolic,Weight_kg,Height_cm,BMI,Smoker_bin,Age_bucket,Diagnosis_Hypertension,Diagnosis_Diabetes,Diagnosis_Obesity,Age_Young,Age_Middle-aged,Age_Senior\n001,2023/01/15,45,Male,Hypertension,78kg,175 cm,120/80,Yes,2023-01-15,45,male,Hypertension,120,80,78,175,25.5,1,Middle-aged,1,0,0,0,1,0\n002,15-02-2023,60,female,Diabetes type 2,85 kg,168cm,130/85,no,2023-02-15,60,female,Diabetes,130,85,85,168,30.1,0,Senior,0,1,0,0,0,1\n003,2023-03-10,47,Male,hypertension,NaN,180,125/82,Yes,2023-03-10,47,male,Hypertension,125,82,NaN,180,NaN,1,Middle-aged,1,0,0,0,1,0\n004,04/25/2023,35,FEMALE,Obesity,95 kg,NaN,140/90,,2023-04-25,35,female,Obesity,140,90,95,NaN,NaN,0,Young,0,0,1,1,0,0\n005,2023.05.05,50,Male,Diabetes Type 2,88kg,172 cm,135/90,y,2023-05-05,50,male,Diabetes,135,90,88,172,29.7,1,Middle-aged,0,1,0,0,1,0\n006,06-15-2023,29,Female,hypertension,70kg,165cm,115/75,No,2023-06-15,29,female,Hypertension,115,75,70,165,25.7,0,Young,1,0,0,1,0,0\n007,2023/07/20,55,Male,Obesity,NaN,178 cm,145/95,Yes,2023-07-20,55,male,Obesity,145,95,NaN,178,NaN,1,Middle-aged,0,0,1,0,1,0\n008,08/10/2023,42,Female,Diabetes,82kg,170cm,128/85,No,2023-08-10,42,female,Diabetes,128,85,82,170,28.4,0,Middle-aged,0,1,0,0,1,0\n009,2023-09-01,39,Male,Hypertension,80kg,179 cm,NaN,yes,2023-09-01,39,male,Hypertension,NaN,NaN,80,179,25.0,1,Young,1,0,0,1,0,0\n010,10/12/2023,65,Female,Diabetes Type 2,90kg,168,138/88,No,2023-10-12,65,female,Diabetes,138,88,90,168,31.9,0,Senior,0,1,0,0,0,1"}
{"purpose": "Engineer features for predicting customer purchase likelihood based on session and product interaction data.", "raw_table": "SessionID,CustomerID,SessionStart,ProductCategory,ProductPrice,Quantity,Device,Purchase\nS001,cust_01,2023-03-01 10:15 AM,Electronics,299.99,1,Mobile,Yes\nS002,CUST_02,03/02/2023 14:30,electronics,Three hundred,2,Desktop,No\nS003,cust_03,2023-03-03,Home & Garden,89.50, ,mobile,Yes\nS004,CUST_04,3/4/2023 09:00 AM,Fashion,49.99,1,Laptop,No\nS005,cust_05,2023-03-05 16:45,home & garden,75.00,3,Tablet,Yes\nS006,CUST_06,2023/03/06 11:20,Fashion, ,2,Mobile,No\nS007,cust_07,Mar 7 2023 13:50,Electronics,199.99,1,Desktop,Yes\nS008,CUST_08,2023-03-08 15:00,fashion,59.95,One,Laptop,No\nS009,cust_09,2023-03-09 18:10,Home & garden,99,2,mobile,Yes\nS010,CUST_10,2023/03/10 20:00,electronics,150.00,1,desktop,No", "fe_steps": ["Standardize all CustomerID values to lowercase", "Parse SessionStart into a datetime object and extract day_of_week and hour_of_day", "Correct ProductPrice by converting textual and missing values to numeric, setting invalids to median price", "Convert Quantity to integer, replacing non-numeric or missing with 1", "Normalize ProductCategory by capitalizing first letters and trimming whitespace", "Standardize Device values to one of ['Mobile', 'Desktop', 'Laptop', 'Tablet'] with proper capitalization", "Create total_spent feature by multiplying ProductPrice and Quantity", "One-hot encode ProductCategory", "Map Purchase column to binary target with 1 for 'Yes' and 0 for 'No'"], "fe_table": "SessionID,CustomerID,SessionStart,ProductCategory,ProductPrice,Quantity,Device,Purchase,day_of_week,hour_of_day,total_spent,ProductCategory_Electronics,ProductCategory_Home & Garden,ProductCategory_Fashion,Purchase_Binary\nS001,cust_01,2023-03-01 10:15 AM,Electronics,299.99,1,Mobile,Yes,Wednesday,10,299.99,1,0,0,1\nS002,cust_02,2023-03-02 14:30:00,Electronics,199.995,2,Desktop,No,Thursday,14,399.99,1,0,0,0\nS003,cust_03,2023-03-03 00:00:00,Home & Garden,89.5,1,Mobile,Yes,Friday,0,89.5,0,1,0,1\nS004,cust_04,2023-03-04 09:00:00,Fashion,49.99,1,Laptop,No,Saturday,9,49.99,0,0,1,0\nS005,cust_05,2023-03-05 16:45:00,Home & Garden,75.0,3,Tablet,Yes,Sunday,16,225.0,0,1,0,1\nS006,cust_06,2023-03-06 11:20:00,Fashion,99.995,2,Mobile,No,Monday,11,199.99,0,0,1,0\nS007,cust_07,2023-03-07 13:50:00,Electronics,199.99,1,Desktop,Yes,Tuesday,13,199.99,1,0,0,1\nS008,cust_08,2023-03-08 15:00:00,Fashion,59.95,1,Laptop,No,Wednesday,15,59.95,0,0,1,0\nS009,cust_09,2023-03-09 18:10:00,Home & Garden,99.0,2,Mobile,Yes,Thursday,18,198.0,0,1,0,1\nS010,cust_10,2023-03-10 20:00:00,Electronics,150.0,1,Desktop,No,Friday,20,150.0,1,0,0,0"}
